ds_id,date_added,date_last_updated,source_type,cataloging_convention,holding_institution_ds_qid,holding_institution_as_recorded,holding_institution_id_number,holding_institution_shelfmark,link_to_holding_institution_record,iiif_manifest,production_place_as_recorded,production_place_ds_qid,production_date_as_recorded,production_date,century,century_aat,dated,title_as_recorded,title_as_recorded_agr,uniform_title_as_recorded,uniform_title_agr,standard_title_ds_qid,genre_as_recorded,genre_ds_qid,subject_as_recorded,subject_ds_qid,author_as_recorded,author_as_recorded_agr,author_ds_qid,artist_as_recorded,artist_as_recorded_agr,artist_ds_qid,scribe_as_recorded,scribe_as_recorded_agr,scribe_ds_qid,associated_agent_as_recorded,associated_agent_as_recorded_agr,associated_agent_ds_qid,former_owner_as_recorded,former_owner_as_recorded_agr,former_owner_ds_qid,language_as_recorded,language_ds_qid,material_as_recorded,material_ds_qid,physical_description,note,acknowledgments,data_processed_at,data_source_modified,source_file
DS218,,,ds-mets-xml,ds-mets,Q801,Providence Public Library,Ege MS 1,Ege MS 1,https://archive.org/details/EgeMS1_28,https://iiif.archive.org/iiif/images_EgeMS1_28/manifest.json,France,Q122,s. XIII(1/4); 1200-1225,1200^1225,13,http://vocab.getty.edu/aat/300404505,false,"Bible, O. T.","","","",Q661;Q664,"","","","","","","","","","","","","","","","",From the leaves of Otto F. Ege (1888-1951).,"",Q808,Latin,Q113,parchment,Q33,"Script, f. 1r-v: Gothic.|Layout, f. 1r-v: 2 columns of 56 lines, written above top line.","f. 1r-v: Text block measures 130 x 80 mm.|f. 1r-v: Latin.|f. 1r-v: The verso contains Numbers 36:2 to end, and Deuteronomy 1:1-1:36. Notes in the margins in at least 2 hands, one that cites other relevant biblical passages, and one that corrects the text.","",2024-11-04 11:05:42 -0500,2011-11-08T02:46:44,ds_50_28_00132488.xml
DS219,,,ds-mets-xml,ds-mets,Q801,Providence Public Library,Ege MS 2,Ege MS 2,https://archive.org/details/EgeMS2_28,https://iiif.archive.org/iiif/images_EgeMS2_28/manifest.json,France,Q122,s. XIII/XIV; 1290-1310,1290^1310,13;14,http://vocab.getty.edu/aat/300404505;http://vocab.getty.edu/aat/300404506,false,"Bible, O. T.","","","",Q661;Q664,"","","","","","","","","","","","","","","","",From the leaves of Otto F. Ege (1888-1951).,"",Q808,Latin,Q113,parchment,Q33,"Script, f. 1r-v: Gothic.|Layout, f. 1r-v: 2 columns of 32 lines.","f. 1r-v: Text block measures 120 x 82 mm.|f. 1r-v: Latin.|f. 1r-v: The verso contains Jeremiah 33:14 to end, and 34:1-3.","",2024-11-04 11:05:42 -0500,2011-11-08T02:48:38,ds_50_28_00132489.xml
DS220,,,ds-mets-xml,ds-mets,Q801,Providence Public Library,Ege MS 3,Ege MS 3,https://archive.org/details/EgeMS3_28,https://iiif.archive.org/iiif/images_EgeMS3_28/manifest.json,Armenia,Q791,s. XVII?,"",,,false,Lectionary,"","","",Q663,"","","","","","","","","","","","","","","","",From the leaves of Otto F. Ege (1888-1951).,"",Q808,Armenian,Q792,paper,Q31,"Script, f. 1r-v: Bolorgir.",f. 1r-v: The single columns each measure 285 x 75 mm.|f. 1r-v: Armenian.,We are grateful to Dr. Sylvie L. Merian for identifying this leaf. identifying this leaf.,2024-11-04 11:05:42 -0500,2011-11-08T02:50:36,ds_50_28_00132490.xml
DS216,,,ds-mets-xml,ds-mets,Q801,Providence Public Library,Wetmore MS 1,Wetmore MS 1,https://archive.org/details/WetmoreMS1_28,https://iiif.archive.org/iiif/images_WetmoreMS1_28/manifest.json,Germany,Q131,s. XV(ex); 1485-1499,1485^1499,15,http://vocab.getty.edu/aat/300404465,false,"Tabula aurea|Claves sacre scripture|Bible study guide|Bible in mnemonic form|Biblical genealogies|List of Roman Emperors|Conclusiones|Tabula aurea|Tabula aurea|Tabula aurea|Incipiunt ethimologie et concordantie conclusionum per reverendissimum dominum magistrum petrum de pergamo|List of Holy Roman Emperors|Tabula aurea|Conclusiones""|Orationes itinerantium|Prayers",|||||||||||||||,|||||||||||||||,|||||||||||||||,Q796|Q794|Q661|Q661|Q800|Q3116|Q39264|Q796|Q796|Q796|Q797|Q3116|Q796|Q39264|Q799|Q798,"","","","",Peter of Bergamo,"",Q802,"","","","","","","","","","Henry, Prince of Wales (1594-1612); Thomas Watson (1720-79), S. J.;Thomas Pennant (1726-98); by inheritance to Rudolph (1823-92), Earl of Denbigh; Denbigh sale, Christie's, 4-7-1938, lot 12 to Stonehill; Edith Wetmore (1870-1966); in 1955 to Prov.Pub.Lib.","",Q803;Q804;Q805;Q806;Q807,Latin,Q113,parchment,Q33,"Binding: Gold-stamped calf: in each corner 2 arrows in saltire, points in base, surmounted by a heart and ensigned with a royal crown, within a base of fleur-de-lys and in the flaunches a Tudor rose; center stamp of feathers, enfiled with a crown, w/olive branches.|Figurative details, ff. 1-149v: Innumerable sketched figures that act as a rebus-like mnemonic device, with the same figure reoccuring at need.|Script, ff. 1-149v: Gothic cursive.|Layout, ff. 1-149v: Bible usually in 10 compartments to a page: 3 rectangular shapes each in upper & lower registers ; 4 in the middle register but in triangular shapes formed by a V (itself dimidiated) placed over the entire middle register.","Manuscript note: It is said that the book had been a gift from Elizabeth of Bohemia (1596-1662), daughter of James I of England, to her brother, Henry. Former call number: C091 B582b.|Bibliography: Susanne Rischpler, Biblia Sacra figuris expressa: Mnemotechnische Bilderbibln des 15. Jahrhunderts(Wiesbaden 2001), discussing the five known mss of this type; the Providence book is described on pp. 187-190; meanings of the symbols are on pp. 171-181.|ff. 1-149v: Foliated in modern pencil in lower right corner of recto. In the center lower margins of ff. 7, 15, 25, 35, 45, 55, 64, 76 are red roman numerals (I - VIII) that may be quire numbers.|ff. 1-149v: Latin.|ff. i-iii verso + 1-3; ff. 3v-5v blank: Doctoris angelici divi Thomæ Aquinatis Opera omniaed. By Stanislas Edouard Frette' and Paul Mare' (Paris, 1871-1880) vols. 34-35; here copied sparsim throughout the book, and to be read in this order: ff. 130-138v, 119-128v, 1-3, 140-147v, 129.|f. 6: Text is divided into seven points, and is complete on this page.|ff. 6v-7: Groupings of the O.T. books of the bible into Legal, Historical, Sapiential, Prophetic; then the N.T. in the Gospels, the Catholic Epistles, the Pauline Epistles (this list carried forward by a tie mark, ""f,"" from the lower verso to the recto).|ff. 87-100: This text also in Vienna, Osterreichische Nationalbibliothek, Cod. 505, ff. 3-11v, containing the series of O.T. patriarchs from Adam to Christ. Each genealogical line follows a specific colored line: red, blue, light purple and so on.|Incipit, ff. 87-100: ascensionis et pentecosten.|Explicit, ff. 87-100: Considerans sacre historie prolixitatem.|ff. 100-110v: Sequence of Roman emperors and German and Bohemian kings along a green line, beginning with Claudius and ending with Frederick III of Hapsburg who reigned 1452-1493; his accession date provides a possible terminus post quem for the copying of the ms.|f. 111v; ff. 112-116v blank: Sketch of two heads, possibly later in date, on otherwise blank leaves.|ff. 117-118v: Materials relevant to the Dominicans for preaching. The Conclusionesare copied at two points throughout the book and should be read ff. 117-118v, 148r.|ff. 119-128v: Doctoris angelici divi Thomæ Aquinatis Opera omniaed. By Stanislas Edouard Frette' and Paul Mare' (Paris, 1871-1880) vols. 34-35; here copied sparsim throughout the book, and to be read in this order: ff. 130-138v, 119-128v, 1-3, 140-147v, 129.|f. 129r-v: Doctoris angelici divi Thomæ Aquinatis Opera omniaed. By Stanislas Edouard Frette' and Paul Mare' (Paris, 1871-1880) vols. 34-35; here copied sparsim throughout the book, and to be read in this order: ff. 130-138v, 119-128v, 1-3, 140-147v, 129.|ff. 130-138v: Doctoris angelici divi Thomæ Aquinatis Opera omniaed. By Stanislas Edouard Frette' and Paul Mare' (Paris, 1871-1880) vols. 34-35; here copied sparsim throughout the book, and to be read in this order: ff. 130-138v, 119-128v, 1-3, 140-147v, 129.|f. 139v: S. Rischpler suggests that this list was added to the book while in the possession of Henry, Prince of Wales (d. 1612), although the hand does not look English, and the list only need have been added after the accession of Rudolph II in 1576.|ff. 140-147v: Doctoris angelici divi Thomæ Aquinatis Opera omniaed. By Stanislas Edouard Frette' and Paul Mare' (Paris, 1871-1880) vols. 34-35; here copied sparsim throughout the book, and to be read in this order: ff. 130-138v, 119-128v, 1-3, 140-147v, 129.|f. 148; f. 148v blank: Materials relevant to the Dominicans for preaching. The Conclusionesare copied at two points throughout the book and should be read ff. 117-118v, 148r.|f. 149; f. 149v blank: Prayers based on the psalm, Levavi oculos meos.","",2024-11-04 11:05:42 -0500,2011-11-08T11:34:00,ds_50_28_00132486.xml
DS217,,,ds-mets-xml,ds-mets,Q801,Providence Public Library,Wetmore MS 2,Wetmore MS 2,https://archive.org/details/WetmoreMS2_28,https://iiif.archive.org/iiif/images_WetmoreMS2_28/manifest.json,Netherlands,Q651,s. XV(ex); 1485-1499,1485^1499,15,http://vocab.getty.edu/aat/300404465,false,Book of Hours,"","","",Q795,"","","","","","","","","","","","","","","","",Gift of Edith Wetmore (1870-1966) in 1955 to the Providence Public Library.,"",Q803,Dutch,Q793,parchment,Q33,"Binding: Bound in full calf; kept in a slipcase.|Figurative details, ff. 1-132v: Miniatures and historiated initials.|Script, ff. 1-132v: Hybrida.|Layout, ff. 1-132v: 15 long lines.",ff. 1-132v: Text block measures 95 x 70 mm.|ff. 1-132v: Latin.,"",2024-11-04 11:05:42 -0500,2011-11-08T02:41:35,ds_50_28_00132487.xml
