title_as_recorded,title_as_recorded_agr,uniform_title_as_recorded,uniform_title_as_recorded_agr,authorized_label_add,ds_qid_add,authorized_label,ds_qid
Risālah fī al-hayʼah,,,,Risālah fī al-hayʼah,Q27552,,
al-Mughnī fī sharḥ al-Mūjiz,,,,al-Mughnī fī Sharḥ al-Mūjaz,Q108588,,
Mūjiz al-Qānūn,,,,Mūjiz al-Qānūn,Q39496,,
Sharḥ Mūjiz al-Qānūn,,,,Mūjiz al-Qānūn,Q39496,,
al-Mukhtārāt fī al-ṭibb,,,,al-Mukhtārāt fī al-ṭibb,Q108607,,
Sharḥ al-Mulakhkhaṣ fī al-hayʼah,,,,Sharḥ al-Mulakhkhaṣ fī al-hayʼah,Q108586,,
Sharḥ ʻalá sharḥ Qāḍīzāde ʻalá al-Mulakhkhaṣ fī al-hayʼah,,,,,,,
al-Najāh,,,,,,,
Naqd al-uṣūl wa-talkhīṣ al-fuṣūl,,,,,,,
al-Qānūn fī al-ṭibb,,,,,,Canon of Medicine,Q2826
Sharḥ al-Qānūn fī al-ṭibb,,,,Commentary on Avicenna,Q44052,,
Astronomical treatise called Bist Bab,,,,Bist Bab;Astronomical text,Q27717;Q38381,,
Maṭlaʻ al-anwār ... [etc,مطلع الانوار ... الخ,,,,,,
Durrah al-sanīyah fī waḍʻ basāʼiṭ faḍl al-dāʼir bi-al-ṭuruq al-handasīyah ... [etc,درة السنية في وضع بسائط فضل الدائر بالطرق الهندسية ... الخ,Works,اعمال,,,,
ʻAyn al-qawāʻid fī al-manṭiq ... [etc,عين القواعد في المنطق ... الخ,,,,,,
Lawāmiʻ al-asrār fī sharḥ Maṭāliʻ al-anwār ... [etc,لوامع الاسرار في شرح مطالع الانوار ... الخ,,,Lawāmiʻ al-asrār fī sharḥ Maṭāliʻ al-anwār,Q39530,,
Risālah al-fatḥīyah fī al-aʻmāl al-jaybīyah ... [etc,رسالة الفتحية في الاعمال الجيبية ... الخ,,,,,,
Mukhtaṣar fī maʻrifat al-taqāwīm ... [etc,مختصر في معرفة التقاويم ... الخ,,,,,,
Sawāniḥ al-qarīḥah fī sharḥ al-Ṣafīḥah ... [etc,سوانح القريحة في شرح الصفيحة ... الخ,,,,,,
Ḥāshiyah ʻalá Sharḥ Īsāghūjī,حاشية على شرح ايساغوجي,,,Commentary on Īsāghūjī,Q103546,,
Majmūʻah-yi rasāʼil-i nādirah fī al-ʻulūm al-falakīyah,مجموعه رسائل نادرة في العلوم الفلكية,,,,,,
İlm-i mantıkdin Sullam al-murawniq şerhi,,Sharḥ al-Sullam,,,,,
Kitāb al-Tafhīm li-awāʾil ṣināʻat al-tanjīm,كتاب التفهيم لاوائل صناعة التنجيم,Tafhīm li-awāʾil ṣināʻat al-tanjīm,تفهيم لاوائل صناعة التنجيم,Al-Tafhim li Awa'il Sana'at al-Tanjim,Q108610,,
al-Mūjiz fī al-ṭibb,الموجز في الطب,Mūjiz al-Qānūn,موجز القانون,Mūjiz al-Qānūn,Q39496,,
Hādhā kitāb fī al-ṭibb wa-kitāb al-firdaws wa-khuṭab fī ̄ākhir al-kitāb,هذا كتاب في الطب وكتاب الفردوس وخطب في آخر الكتاب,Kitāb fī al-ṭibb,كتاب في الطب,,,,
Hādhihi Ḥāshiyah li-sharḥ al-Hidāyah,هذه حاشية لشرح الهداية,,,,,,
Kitāb Kāmil al-ṣināʻah al-ṭibbīyah al-maʻrūf bi-al-Malikī /,كتاب كامل الصناعة الطبية المعروف بالملكي /,Kāmil al-ṣināʻah al-ṭibbīyah,كامل الصناعة الطبية،,Complete Book of the Medical Art,Q76612,,
Kitāb Kāmil al-ṣināʻah al-ṭibbīyah al-maʻrūfah bi-al-Malakī /,كتاب كامل الصناعة الطبية المعروفة بالملكي /,Kāmil al-ṣināʻah al-ṭibbīyah,كامل الصناعة الطبية,Complete Book of the Medical Art,Q76612,,
Taḥrīr Kitāb Mānālāwis fī al-ashkāl al-kurīyah,تحرير كتاب مانالاوس في الاشكال الكرية,,,,,,
Sharḥ al-Tadhkirah al-Naṣīrīyah /,شرح التذكرة النصيرية,Sharḥ al-Tadhkirah al-Naṣīrīyah,شرح التذكرة النصيرية,Sharḥ al-Tadhkirah al-Naṣīrīyah,Q108604,,
Hādhā Kitāb al-Majisṭī ... [etc,,,,,,,
Jadwal al-ẓill al-awwal al-mankūs al-sittīnī min Zīj Lughbīk,جدول الظل الاول المنكوس الستيني من زيج لغبيك,Zīj-i jadīd-i Sultānī,,Zīj-i jadīd-i Sultānī,Q347,,
Kitāb fī al-shuhūr al-rūmiyah ... [etc,كتاب في الشهور الرومية ... الخ,,,,,,
Kitāb Isiqlāwis fī al-maṭāliʻ ... [etc,كتاب اسقلاوس في المطال ... الخ,,,,,,
Taqdimat al-ʻilāj; Awdiyah al-adwiyah; Rumūz al-minhāj wa-kunūz al-ʻilāj ... [etc,تقدمة العلاج؛ اودية الادويه؛ رموز المنهاج وكنوز العلاج ... الخ,,,,,,
Tanwīr al-Maṭāliʻ,تنوير المطالع,,,,,,
Qarah ḥāshiyah,,,,,,,
Ḥāshiyat ʻIṣām al-Dīn,,,,,,,
Risālah tataʻallaqu bi-wujūb taqdīm al-mūṣil ilá al-taṣawwur ʻalá mabāḥith al-mūṣil ilá al-taṣdīq,,,,,,,
ḥāshiyat Qarah Dāwūd,,,,,,,
ḥāshiyat al-Siyālkūtī,,,,,,,
ḥāshiyah ʻalá ḥāshiyat al-Jurjānī,,,,,,Ḥāshiyah ʻalá ḥāshiyat al-Jurjānī,Q54399
Taʻlīqāt ʻalá al-qism al-thānī min sharḥ al-Shamsīyah,,,,,,,
ḥāshiyah ʻalá taṣdīqāt sharḥ al-Quṭb,,,,,,,
Sharḥ al-Shamsīyah,,,,Sharḥ al-Shamsīyah,Q108603,,
ḥāshiyah ʻalá sharḥ Saʻd al-Dīn,,,,,,,
Sharḥ al-Shamsīyah al-musammá bi-al-Sharḥ al-jadīd,,,,,,,
Lawāmiʻ al-asrār fī sharḥ Maṭāliʻ al-anwār,,,,Lawāmiʻ al-asrār fī sharḥ Maṭāliʻ al-anwār,Q39530,,
ḥāshiyah ʻalá Lawāmiʻ al-asrār,,,,,,,
ḥāshiyah ʻalá sharḥ al-Dawwānī,,,,,,,
ḥāshiyat Qarah Khalīl,,,,,,,
ḥāshiyah ʻalá al-ḥāshiyah al-Fatḥīyah,,,,,,,
Ḥāshiyah ʻalá al-ḥawāshī al-Mīrīyah,,,,,,,
ḥāshiyah ʻalá ḥāshiyat Mīr Abī al-Fatḥ,,,,,,,
ḥāshiyah ʻalá ḥāshiyat al-Khalkhālī,,,,,,,
Sharḥ Tahdhīb al-manṭiq,,,,,,,
ḥāshiyah ʻalá Tahdhīb al-kalām,,,,Ḥāshiyah ʻalá Tahdhīb al-kalām,Q108596,,
Ḥāshiyah ʻalá Tahdhīb al-kalām ... [etc,حاشية على تهذيب الكلام ... الخ,,,Ḥāshiyah ʻalá Tahdhīb al-kalām,Q108596,,
al-Tahdhīb fī sharḥ al-Tahdhīb,,,,,,,
ḥāshiyah ʻalá sharḥ al-Khabīṣī,,,,,,,
Sharḥ al-Ghurrah fī al-rnanṭiq,,,,Sharḥ al-Ghurrah fī al-manṭiq,Q108602,,
Sharḥ al-Ghurrah fī al-manṭiq,,,,Sharḥ al-Ghurrah fī al-manṭiq,Q108602,,
Sharḥ Muqaddimat Īsāghūjī,,,,,,,
Sharḥ Risālat al-ʻilm,,,,,,,
Sharḥ al-Sullam,,,,,,,
al-Munhiyah,,,,,,,
ʻArāʼis al-nafāʼis,,,,ʻArāʼis al-nafāʼis,Q108598,,
ʻArāʼis al-anẓār wa-nafāʼis al-abkār,,,,,,,
Miftāḥ bāb al-muwajjahāt,,,,,,Text on logic,Q20450
Ḥāshiyah ʻalā Tahdhīb al-manṭiq,,,,Ḥāshiyah ʻalá Tahdhīb al-mantiq,Q51972,,
Ḥāshiyah ʻalá Tahdhīb al-manṭiq,,,,Ḥāshiyah ʻalá Tahdhīb al-mantiq,Q51972,,
Ḥāshiyah bar Tahdhīb,حاشىه بر تهذىب,Ḥāshiyah ʻalá Tahdhīb al-manṭiq,حاشية على تهذيب المنطق,,,,
Taḥrīr al-Mijistī,,,,,,,
Taḥrīr al-qawāʻid al-manṭiqīyah fī sharḥ al-Risālah al-Shamsīyah,,,,Taḥrīr al-qawāʻid al-manṭiqīyah fī sharḥ al-Risālah al-Shamsīyah,Q108587,,
al-Talwīḥ ilá asrār al-Tanqīh,,,,,,,
Tanqīḥ al-idrāk fī tawḍīḥ Tashrīḥ al-aflāk,,,,,,,
Sharḥ Taqdimat al-maʻrifah,,,,,,,
Taqwīm al-adwiyah al-mufradah,,,,,,,
Tashrīḥ al-aflāk,,,,,,Tashrīḥ al-aflāk,Q11935
Hādhā Kitāb al-Ṭāliʼ al-saʻīd fī al-manṭiq al-ḥamīd /,,Ṭāliʼ al-saʻīd fī al-manṭiq al-ḥamīd,,,,,
Collection of Arabic Christian texts,,,,Arabic texts;Religious texts,Q12258;Q5037,,
Collection of Arabic astronomical texts,,,,Arabic texts;Astronomical texts,Q12258;Q3129,,
Collection of Arabic texts,,,,,,Arabic texts,Q12258
Kifāyat al-murtāḍ fī ʻilmay al-abwāl wa-al-a[nbāḍ] ... [etc,كفاية المرتاض في علمي الابوال والانباض ... الخ,,,,,,
Collection of Arabic and Persian texts on astronomy,,,,Arabic texts;Persian texts;Astronomical texts,Q12258;Q7568;Q3129,,
Maqālah fī qismat al-zāwiyah bi-thalāthat aqsām mutasāwiyah ... [etc,مقالة في قسمة الزاوية بثلاثة اقسام متساوية ... الخ,,,,,,
Ḥāshiyah ʻalá Qūl Aḥmad min al-manṭiq ... [etc,حاشية على قول احمد من المنطق ... الخ,,,,,,
Collection of Arabic texts on dialectic and logic,,,,Arabic texts,Q12258,,
Collection of Arabic texts on arithmetic,,,,Arabic texts;Mathematical texts,Q12258;Q38402,,
Sharḥ Khulāṣat al-ḥisāb,,,,,,Sharḥ Khulāṣat al-ḥisāb,Q27600
Collection of Arabic and Persian texts,,,,,,Arabic texts;Persian texts,Q12258;Q7568
Sharḥ al-Asbāb wa-al-ʻalāmāt,,,,Sharḥ al-Asbāb wa-al-ʻalāmāt,Q108601,,
Kitāb Sharḥ Naẓm al-muwajjahāt ʻalá namaṭ al-Tahdhīb,,Sharḥ Naẓm al-muwajjahāt ʻalá namaṭ al-Tahdhīb,,,,,
Hāz̲ā kitāb Risālah-i taʻlīmʹnāmah dar ʻamal-i ābilah zadan ... [etc.,هذا کتاب رساله تعلىم‌نامه در عمل آبله زدن,Risālah-i taʻlīmʹnāmah dar ʻamal-i ābilah zadan,رساله تعلىم‌نامه در عمل آبله زدن,,,,
Taʻdīl al-mīzān fī taʻlīq ʻilm al-mīzān,,,,,,,
Mukhtaṣar al-Tadhkirah al-hādiyah,,,,Mukhtaṣar al-Tadhkirah al-hādiyah,Q108600,,
Sharḥ al-Tadhkirah fī al-hayʼah,,,,,,,
Tadhkirat al-kaḥḥālīn,,,,,,,
Ḥāshiyat taṣdīqāt ʻIṣām al-Dīn ʻalá al-Quṭb al-Shāriḥ al-Shamsīyayn,حاشية تصديقات عصام الدين على القطب الشارح الشمسيين,Ḥāshiyah ʻalá taṣdīqāt al-Risālah al-Shamsīyah,حاشية على تصديقات الرسالة الشمسية,,,,
Kitāb al-Dukkān,كتاب الدكان,Dukkān,دكان,,,,
al-Mujallad al-thānī min Sharḥ Sharḥ wa-ikhtiṣār Sharḥ al-Asbāb /,المجلد الثاني من شرح شرح واختصار شرح الاسباب /,Sharḥ Sharḥ wa-ikhtiṣār Sharḥ al-Asbāb,شرح شرح واختصار شرح الاسباب,,,,
Nuzʹhat al-naẓar fī ḥāl al-shams wa-al-qamar,نزهة النظر في حال الشمس والقمر,,,,,,
Ḥāshiyah ʻalá Sharḥ Shamsīyah,حاشية على شرح شمسية,,,,,,
Taḥrīr al-qawāʻid al-manṭiqīyah fī sharḥ al-Risālah al-Shamsīyah,تحرير القواعد المنطقية في شرح الرسالة الشمسية,,,Taḥrīr al-qawāʻid al-manṭiqīyah fī sharḥ al-Risālah al-Shamsīyah,Q108587,,
Hādhā Sharḥ al-sabʻ āyāt,هذا شرح السبع آيات,Sharḥ al-sabʻ āyāt,شرح السبع آيات,,,,
Mūjiz fī al-ṭibb,موجز في الطب,Mūjiz al-Qānūn,موجز القانون,Mūjiz al-Qānūn,Q39496,,
Sharḥ al-Jighmīnī fī al-hayʼah /,شرح الجغميني في الهيئة /,Sharḥ al-Mulakhkhaṣ fī al-hayʼah,شرح الملخص في الهيئة,Sharḥ al-Mulakhkhaṣ fī al-hayʼah,Q108586,,
Kitāb al-Taṣrīḥ bi-al-maknūn fī tanqīḥ al-Qānūn /,كتاب التصريح بالمكنون في تنقيح القانون /,Taṣrīḥ bi-al-maknūn fī tanqīḥ al-Qānūn,تصريح بالمكنون في تنقيح القانون,,,,
Taqāwīm al-sayyārah wa-al-aʻmāl al-zījīyah,تقاوىم السىارة والاعمال الزىجىة,,,,,,
Hādhā Kitāb matn al-Nuzʹhah,هذا كتاب متن النزهة,Nuzʹhat al-nuẓẓār fī ʻilm al-ghubār,نزهة النظار في علم الغبار,,,,
Hādhihi Muqaddimat al-Lumʻah fī ʻilm al-ḥisāb /,هذه مقدمة اللمعة في علم الحساب /,Lumaʻ al-yasīrah fī ʻilm al-ḥisāb,لمع اليسيرة في علم الحساب,Lumaʻ al-yasīrah fī ʻilm al-ḥisāb,Q108611,,
Hādhā matn al-Lumaʻ /,هذا متن اللمع /,Lumaʻ al-yasīrah fī ʻilm al-ḥisāb,لمع اليسيرة في علم الحساب,Lumaʻ al-yasīrah fī ʻilm al-ḥisāb,Q108611,,
Khulāṣat al-ḥisāb,خلاصة الحساب,,,,,Khulāṣat al-ḥisāb,Q27667
Sabk al-nuḍār naẓm Nuzʹhat al-nuẓẓār fī ʻilm,سبك النضار نظم نزهة النظار في علم,,,,,,
Kitāb Sharḥ al-Yāsamīnīyah fī ʻilm al-jabr wa-al-muqābalah /,كتاب شرح الياسمينية في علم الجبر والمقابلة /,Sharḥ al-Yāsamīnīyah,شرح الياسمينية,Sharḥ al-Yāsamīnīyah,Q108605,,
Hādhihi Ḥāshiyah ʻalá Sharḥ Sibṭ al-Māridīnī al-Ṣaghīr /,هذه حاشية على شرح سبط المارديني الصغير /,Farāʼid ʻawāʼid jabrīyah ʻalá sharḥ al-Sibṭ lil-Yāsamīnīyah,فرائد عوائد جبرية على شرح السبط للياسمينية,,,,
Bayān al-ḥikmah,بىان الحکمة,,,,,,
Sharḥ AshkāI al-taʼsīs,شرح اشکال التأسىس,,,,,,
ḥāshiyah ʻalá Sharḥ Ashkāl al-taʼsīs fī al-handasah,حاشىة على شرح اشکال التأسىس في الهندسة,,,,,,
Risālat madkhal fī ʻilm al-handasah,رسالة مدخل في علم الهندسة,,,,,,
Hādhihi Risālah fī iqtināʼ barāhīn al-ʻulūm al-ḥisābīyah wa-al-aʻmāl al-jabrīyah wa-al-masāḥīyah ʻalá ashkāl al-taʼsīs min kitāb Uqlīdis,هذه رساله في اقتنا براهين العلوم الحسابيه والاعمال الجبريه والمساحيه على اشكال التاسيس من كتاب اقليدس,Risālah fī iqtināʼ barāhīn al-ʻulūm al-ḥisābīyah wa-al-aʻmāl al-jabrīyah wa-al-masāḥīyah ʻalá ashkāl al-taʼsīs min kitāb Uqlīdis,رسالة في اقتناء براهين العلوم الحسابية والاعمال الجبرية والمساحية على اشکال التأسيس من کتاب اقليدس,,,,
Kitāb al-Qānūn fī ʻilm al-ṭibb,كتاب القانون فى علم الطب,Qānūn fī al-ṭibb,قانون في الطب,,,Canon of Medicine,Q2826
al-Qānūn fī al-ṭibb,القانون في الطب,,,,,Canon of Medicine,Q2826
al-Mughnī fī Sharḥ al-Mūjaz,المغني في شرح الموجز,,,al-Mughnī fī Sharḥ al-Mūjaz,Q108588,,
Sharḥ al-Mūjaz /,شرح الموجز /,Sharḥ al-Mūjaz fī al-ṭibb,شرح الموجز في الطب,Sharḥ al-Mūjaz fī al-ṭibb,Q12085,,
Kitāb sharḥ wa-muḥākamat al-ṭibb,كتاب شرح ومحاكمة الطب,,,,,,
Sharḥ FuṣūI Abuqrāṭ,شرح فصول ابقراط,,,,,,
Sharḥ ʻalá Masāʼil fī al-ṭibb lil-mutaʻallimīn,شرح على مسائل في الطب للمتعلمين,,,,,,
Kitāb Taqwīm al-abdān bi-mudāwāt al-amrāḍ /,كتاب تقويم الابدان بمداوات الامراض /,Taqwīm al-abdān bi-mudāwāt al-amrāḍ,تقويم الابدان بمداوات الامراض,Kitāb Taqwīm al-abdān bi-mudāwāt al-amrāḍ,Q108599,,
Kitāb Taqwīm al-abdān bi-mudāwāt al-amrāḍ,کتاب تقويم الابدان بمداوات الامراض,Taqwīm al-abdān bi-mudāwāt al-amrāḍ,تقويم الابدان بمداوات الامراض,Kitāb Taqwīm al-abdān bi-mudāwāt al-amrāḍ,Q108599,,
Laqṭ al-manāfiʻ fī al-ṭibb,لقط المنافع في الطب,,,,,,
Sharḥ al-Asbāb wa-al-ʻalāmāt,شرح الاسباب والعلامات,,,Sharḥ al-Asbāb wa-al-ʻalāmāt,Q108601,,
Mukhtaṣar al-Tadhkirah al-hādiyah,مختصر التذکرة الهادية,,,Mukhtaṣar al-Tadhkirah al-hādiyah,Q108600,,
Kitāb Unmūdhaj fī al-ṭibb,كتاب انموذج في الطب,,,,,,
Jawāhir al-lughah,جواهر اللغة,Baḥr al-jawāhir,,Jawāhir al-lughah,Q108589,,
Kitāb Baḥr al-jawāhir fī ʻilm al-ṭibb,كتاب بحر الجواهر فى علم الطب,Baḥr al-jawāhir,بحر الجواهر,Baḥr al-jawāhir,Q108612,,
Fragment on medicine,,,,Medical text,Q20372,,
Two fragmentary medical texts,,,,Medical texts,Q817,,
al-Durar al-muntakhabah fī al-adwiyah al-mujarrabah,الدرر المنتخبة في الادوىة المجرّبة,,,,,,
al-Durūj fī al-mujarrabāt,الدروج في المجربات,,,,,,
Kitāb Sharḥ al-ṣadr bi-Laylat al-Qadr ... [etc,كتاب شرح الصدر بليلة القدر ... الخ,,,,,,
Tahdhīb al-manṭiq wa-al-kalām ... [etc,تهذيب المنطق والكلام ... الخ,,,,,Tahdhīb al-manṭiq wa-al-kalām,Q64068
Ḥāshiyat al-Riḍawī ... [etc,حاشية الرضوي ... الخ,,,,,,
ḥāshiyah ʻalá Maṭāliʻ al-anwār,,,,Ḥāshiyah ʻalá Maṭāliʻ al-anwār,Q11906,,
Ḥāshiyah ʻalá ḥāshiyat al-Jurjānī ʻalá Maṭāliʻ al-anwār,,,,,,,
Ḥāshiyah ʻalá Maṭāliʻ al-anwār,,,,Ḥāshiyah ʻalá Maṭāliʻ al-anwār,Q11906,,
Minhāj al-dukkān,,,,,,,
Manṭiq min kalām al-Shaykh al-imām al-ʻallāmah shaykh al-Islām Burhān al-Dīn al-Fazārī mattaʻa Allāh al-muslimīn bi-baqāʼihi wa-huwa al-manṭiq alladhī ʻamalahu ʻalá manṭiq Ibn al-Ḥājib fī al-Mukhtaṣar,منطق من كلام الشيخ الامام العلامة شيخ الاسلام برهان الدين الفزاري متع الله المسلين ببقائه وهو المنطق الذي عمله على منطق ابن الحاجب في المختصر,,,,,,
Kashf al-jilbāb fī ʻilm al-ḥisāb,كشف الجلباب في علم الحساب,,,,,,
Sharḥ Īsāghūjī,,,,Sharḥ Īsāghūjī,Q11905,,
Jawāhir al-lughah,,Baḥr al-jawāhir,,Jawāhir al-lughah,Q108589,,
Jawāhir al-lughah,,,,Jawāhir al-lughah,Q108589,,
Muʻlam ʻalá ḥurūf al-muʻjam ... [etc,معلم على حروف المعجم ... الخ,,,,,,
Murshidat al-ṭālib ilá asná al-maṭālib ... [etc,مرشدة الطالب الى اسنى المطالب ... الخ,,,,,,
Talkhīṣ al-bayān fī ʻalāmāt al-Mahdī ākhir al-zamān ... [etc,تلخيص البيان في علامات المهدي آخر الزمان ... الخ,,,,,,
Bayān tafsīr āyāt jalīlah ... [etc,بيان تفسير آيات جليلة ... الخ,,,,,,
Ḥāshiyat Qūl Aḥmad ... [etc,حاشية قول احمد ... الخ,,,Ḥāshiyat Qūl Aḥmad,Q108597,,
Kitāb Sharḥ Ādāb mā yatakarraru fī al-yawm wa-al-laylah /,كتاب شرح آداب ما يتكرر في اليوم والليلة /,Sharḥ Ādāb mā yatakarraru fī al-yawm wa-al-laylah,,,,,
al-Sharḥ,الشرح,Sharḥ al-Yāsamīnīyah,شرح الياسمينية,Sharḥ al-Yāsamīnīyah,Q108605,,
Kitāb laṭīf mukhtaṣar li-sharḥ al-Yāsamīnīyah fī al-jabr /,كتاب لطيف مختصر لشرح الياسمينية في الجبر /,Sharḥ al-Yāsamīnīyah,شرح الياسمينية,Sharḥ al-Yāsamīnīyah,Q108605,,
Sharḥ al-Yāsamīnīyah,شرح الياسمينية,,,Sharḥ al-Yāsamīnīyah,Q108605,,
Kitāb al-Mughnī fī al-ṭibb /,كتاب المغني في الطب /,Mughnī fī tadbīr al-amrāḍ wa-maʻrifat al-ʻilal wa-al-aʻrāḍ,مغني في تدبير الامراض ومعرفة العلل والاعراض,,,,
Majmūʻ fī al-falak,مجموع في الفلك,,,,,,
Collection of texts on occult sciences,,,,Occult texts,Q55147,,
Hāshiyah-i Maṭāliʻ /,هاشيه مطالع /,,,,,,
Kitāb Taḥrīr Uqlīdis /,كتاب تحرير اقليدس /,,,Kitab tahrir usul li-Uqlidus,Q108608,,
Hidāyat al-sāʾil ilá maʻrifat al-rubʻ al-kāmil,هداية السائل الى معرفة الربع الكامل,,,,,,
Kitāb al-asbāb wa-al-ʻalāmāt,كتاب الاسباب والعلامات,Asbāb wa-al-ʻalāmāt,اسباب والعلامات,Sharḥ al-Asbāb wa-al-ʻalāmāt,Q108601,,
Ḥāshiyah ʻalá Īsāghūjī fī al-manṭiq,حاشية على ايساغوجي في المنطق,,,,,,
Jawhar al-jawāhir wa-durrat al-mufākhir,جوهر الجواهر ودرة المفاخر,,,,,,
Īsāghūjī,,,,Īsāghūjī,Q55036,,
Ḥāshiyah ʻalá sharḥ Ḥusām al-Kātī,,,,Ḥāshiyah ʻalá sharḥ Ḥusām al-Kātī,Q54549,,
ḥāshiyat Qūl Aḥmad,,,,Ḥāshiyat Qūl Aḥmad,Q108597,,
Jalāʼ al-anẓār fī ḥall ʻawīṣāt al-afkār,,,,,,,
Risālat jihat al-waḥdah,,,,,,,
al-Farāʼid al-ḥasanīyah bi-ḥall al-fawāʼid al-Abharīyah,,,,,,,
Sharḥ Isāghūjī,,,,Sharḥ Īsāghūjī,Q11905,,
al-Risālah al-Shamsīyah fī al-qawāʻid al-manṭiqīyah,,,,,,,
Taḥrīr al-qawāʻid al-manṭiqīyah fī sharḥ al-Risālah al-Shamsīyah,,Sharḥ Shamsīyah,,Taḥrīr al-qawāʻid al-manṭiqīyah fī sharḥ al-Risālah al-Shamsīyah,Q108587,,
ḥāshiyah ʻalá sharḥ Quṭb al-Dīn,,,,,,,
ḥawāshin ʻalá ḥawāshī Sharḥ al-Shamsīyah,,,,,,,
ḥāshiyat al-ʻAjamī,,,,,,,
Majmūʻah fī al-ṭibb /,مجموعة في الطب /,,,,,,
Glosses on al-Shirwānī's commentary on Samarqandī's Risālah fī ādāb al-baḥth,,,,,,,
Kitāb Unmūdhaj al-ʻulūm] ... [etc.,,,,,,,
Kitāb Kāmil al-ṣināʻah al-ṭibbīyah al-maʻrūf bi-al-Malakī /,كتاب كامل الصناعة الطبية المعروف بالملكي /,Kāmil al-ṣināʻah al-ṭibbīyah,كامل الصناعة الطبية,Complete Book of the Medical Art,Q76612,,
Sharḥ al-Mulakhkhaṣ fī al-hayʼah,شرح الملخص في الهيئة,,,Sharḥ al-Mulakhkhaṣ fī al-hayʼah,Q108586,,
al-Tuḥfah al-shāhīyah fī al-hayʼah,التحفة الشاهية في الهيئة,,,,,,
Kitāb al-Mulakhkhaṣ fī al-hayʼah / taʼlīf al-Shaykh al-imām al-ʻālim al-ʻallāmah Maḥmūd ibn Muḥammad ibn ʻUmar al-Jighmīnī,كتاب الملخص في الهيئة / تأليف الشيخ الامام العالم العلامة محمود بن محمد بن عمر الجغميني,Mulakhkhaṣ fī al-hayʼah,ملخص في الهيئة,Mulakhkhaṣ fī al-hayʼah,Q3146,,
al-Mulakhkhaṣ fī al-hayʼah,الملخص في الهيئة,,,,,Mulahhas fī al-Hay'a,Q75941
Kitāb al-Tadhkirah fī ʻilm al-hayʼah,كتاب التذكرة في علم الهيئة,Tadhkirah fī ʻilm al-hayʼah,تذكرة في علم الهيئة,,,,
Tawḍīḥ al-tadhkirah al-Naṣīrīyah /,توضيح التذكرة النصيرية /,,,,,,
Tawḍīḥ al-Tadhkirah,توضيح التذكرة,,,,,,
Ṣuwar al-kawākib,صور الكواكب,,,Ṣuwar al-kawākib,Q27656,,
Ḥāshīyah Jalāl al-Manṭiq maʻa Tatimmat Amīr Abū al-Fatḥ lahā wa maʻa Ḥāshīyah ... ʻalá Jalāl al-Manṭiq,حاشية جلال المنطق مع تتمة امير ابو الفتح لها و مع حاشية ... على جلال المنطق,,,,,,
al-Ḥāshiyah al-jalīlah ... [etc.,الحاشية الجليلة,,,,,,
Ḥāshiyat Mullā Jalāl bar Tahdhīb-i manṭiq,حاشية ملا جلال بر تهذيب منطق,,,,,,
Risālah al-Ḥusaynīyah ... [etc,رسالة الحسينية ... الخ,,,,,,
Tawjīh al-basmalah ... [etc,توجيه البسملة ... الخ,,,,,Tawjīh al-basmalah,Q11910
Itḥāf ʻalá Nubdhat al-isʻāf fī maʻrifat qaws al-khilāf ... [etc,اتحاف على نبذة الاسعاف في معرفة قوس الخلاف ... الخ,,,,,,
Risālat al-mīzān ... [etc,رسالة الميزان ... الخ,,,,,,
al-Qānūn fī al-muʻālajāt,القانون في المعالجات,Qānūn fī al-ṭibb,قانون في الطب,Canon of Medicine,Q2826,,
al-Durrah al-tājiyah fī ʻilm al-ḥisāb,الدرة التاجية في علم الحساب,,,,,,
Tafsīr Abī al-Ḥasan ʻAlī ibn Riḍwān ibn Jaʻfar al-mutaṭabbib li-Kitāb al-arbaʻah Baṭlamiyūs al-Qalawdī fī al-qaḍāʼ bi-al-nujūm ʻalá al-ḥawādith,تفسير ابي الحسن علي بن رضوان بن جعفر المتطبب لكتاب الاربعة بطلميوس القلودي في القضا بالنجوم على الحوادث,,,,,,
al-Malḥamah al-mubārakah ... [etc,الملحمة المباركة ... الخ,,,,,,
al-Futūḥāt al-rabbānīyah ʻalá al-Risālah al-Khānīyah,,,,,,,
Arabic and Persian miscellany,,,,,,Arabic texts;Persian texts,Q12258;Q7568
Collection of Arabic texts on logic and dialectic,,,,Arabic texts,Q12258,,
Majmūʻat rasāʼil,,,,,,Qurʼan commentary,Q39258
Baḥr al-jawāhir fī taḥqīq al-muṣṭalaḥāt al-ṭibbīyah min al-ʻArabīyah wa-al-Lāṭīnīyah wa-al-Yūnānīyah /,بحر الجواهر في تحقيق المصطلحات الطبية من العربية واللاطينية واليونانية /,Baḥr al-jawāhir,بحر الجواهر,Baḥr al-jawāhir,Q108612,,
Kifāyat al-qunūʻ fī al-ʻamal bi-al-rubʻ al-maqṭūʻ ... [etc,كفاية القنوع في العمل بالربع المقطوع ... الخ,,,,,,
al-Fawāʼid al-Fanārīyah] ... [etc.,الفوائد الفنارية ... الخ,,,,,Fawāʼid al-Fanārīyah,Q11831
Kitāb Muḥyī al-Dīn ... [etc,كتاب محيي الدين ... الخ,,,,,,
Sharḥ al-Risālah al-Shamsīyah] ... [etc.,شرح الرسالة الشمسية ... الخ,,,Sharḥ al-Risālah al-Shamsīyah,Q108590,,
al-Ghurrah fī al-manṭiq] ... [etc,الغرة في المنطق ... الخ,,,,,,
Ḥāshiyah ʻalá Sharḥ Īsāghūjī] ... [etc.,حاشية على شرح ايساغوجي ... الخ,,,Commentary on Īsāghūjī,Q103546,,
Ḥāshiyah ʻalá Tahdhīb al-manṭiq; Sharḥ al-Risālah al-Quṭbīyah,حاشية على تهذيب المنطق ؛,Works,اعمال,Ḥāshiyah ʻalá Tahdhīb al-mantiq;Sharḥ al-Risālah al-Quṭbīyah,Q51972;Q76808,,
Kitāb Sharḥ Nafīsī,كتاب شرح نفيسي,,,,,,
Khān Mullā bar Mīr Zāhid Sharḥ al-Tahdhīb,خانملا بر مير زاهد شرح التهذيب,,,,,,
Taḥrīr al-Majisṭī,تحرير المجسطي,,,,,,
Kitāb Jawāmiʻ ʻilm al-ḥisāb wa-Kitāb al-Tabṣirah fī al-hayʼah,كتاب جوامع علم الحساب وكتاب التبصرة في الهيئة,,,,,,
Makhāyil al-malāḥah fī masāʼil al-misāḥah /,مخايل الملاحة في مسائل المساحة /,,,,,,
Hādhā Kitāb Siyālkūtī ʻalá al-Taṣawwurāt,هذا كتاب سيالكوتي على التصورات,Ḥāshiyat al-Siyālkūtī,حاشية السيالكوتي,,,,
Hādhā Kitāb Qarah Dāwūd ʻalá al-Taṣawwurāt,هذا كتاب قره داود على التصورات,Ḥāshiyat Qarah Dāwūd,حاشية قره داود,Ḥāshiyat Qarah Dāwūd,Q108618,,
Four texts on logic,,,,Text on logic,Q20450,,
al-Jāmiʻ al-Shāhī,الجامع الشاهي,,,,,,
Sharḥ Kullīyāt al-Qānūn fī al-ṭibb,,,,Commentary on Avicenna,Q44052,,
