name_as_recorded,role,name_agr,source_authority_uri,instance_of_add,authorized_label_add,structured_value_add,ds_id_add,ds_qid_add,instance_of,authorized_label,structured_value,ds_qid
"Jaʻbarī, Ibrāhīm ibn ʻUmar, 1242 or 1243-1331 or 1332",author,جعبري، ابراهيم بن عمر,http://id.loc.gov/authorities/names/nr91008254,,,,,,human,Ibrāhīm ibn ʻUmar Jaʻbarī,Q122946968,Q12279
"Jurjānī, ʻAlī ibn Muḥammad, al-Sayyid al-Sharīf, 1340-1413",author,جرجاني، علي بن محمد السيد الشريف، 1340-1413,,,,,,,human,Ali ibn Mohammed al-Jurjani,Q3063378,Q12280
"ʻUmarī, Muḥammad ibn ʻAbd al-Raḥīm, -1408 or 1409",author,عمري، محمد بن عبد الرحيم,,,,,,,human,Muḥammad ibn ʻAbd al-Raḥīm ʻUmarī,Q129951648,Q54123
"Ibn Kathīr, Ismāʻīl ibn ʻUmar, approximately 1301-1373",author,ابن كثير، اسماعيل بن عمر,,,,,,,human,Ibn Kathir,Q369690,Q12281
"Ibn Hishām, ʻAbd Allāh ibn Yūsuf, 1309-1360",author,ابن هشام، عبد الله بن يوسف,http://id.loc.gov/authorities/names/n82220489,,,,,,human,Ibn Hisham Al-Ansari,Q6538102,Q3796
"Ṭaḥāwī, ʻUmar ibn Khālid, active 15th century",scribe,طحاوي، عمر بن خالد، active 15th century,,human,ʻUmar ibn Khālid Ṭaḥāwī,Q131748432,DSNAME7588,Q68198,,,,
"Dhahabī, Muḥammad ibn Aḥmad, 1274-1348",author,ذهبي، محمد بن احمد,,,,,,,human,Al-Dhahabi,Q293554,Q12282
"Damīrī, Muḥammad ibn Mūsá, 1341?-1405",author,دميري، محمد بن موسى,http://id.loc.gov/authorities/names/nr91003385 http://id.loc.gov/authorities/names/nr91003385 http://viaf.org/viaf/sourceID/LC%7cnr91003385,,,,,,human,Al-Damiri,Q330616,Q12283
"Jurjānī, ʻAlī ibn Muḥammad, al-Sayyid al-Sharīf, 1340-1413",author,جرجاني، علي بن محمد السيد الشريف، 1340-1413,,,,,,,human,Ali ibn Mohammed al-Jurjani,Q3063378,Q12280
"Shāṭibī, al-Qāsim ibn Fīrruh, 1144-1194",author,شاطبي، القاسم بن فيره,http://id.loc.gov/authorities/names/n84227571 http://id.loc.gov/authorities/names/n84227571 http://viaf.org/viaf/sourceID/LC%7cn84227571,,,,,,human,Abu-l-Qāsim ibn Fīrruh Shāṭibī,Q12182523,Q12284
"Ibn al-Hāʼim, Aḥmad ibn Muḥammad, -1412",author,ابن الهائم، احمد بن محمد، -1412,,,,,,,human,Ahmad Ibn-Muhammad Ibn-al-Haʾim,Q56250455,Q12285
"Siyawāsī, Aḥmad ibn Maḥmūd, -1455 or 1456",author,سيواسي، احمد بن محمود,http://id.loc.gov/authorities/names/no2007022716 http://id.loc.gov/authorities/names/no2007022716 http://viaf.org/viaf/sourceID/LC%7cno2007022716,,,,,,human,Aḥmad ibn Maḥmūd Siyawāsī,Q122946981,Q12286
"Isfarāyīnī, Muḥammad ibn Muḥammad, -1285",author,اسفراييني، محمد بن محمد، -1285,,,,,,,human,Muḥammad ibn Muḥammad Isfarāyīnī,Q122947965,Q12287
"Ḥarīrī, 1054-1122",author,حريري 1054-1122,,,,,,,human,Abu al-Hariri,Q286097,Q12288
"Maqarrī, Rajab ibn Ḥasan, active 15th century",scribe,مقري، رجب بن حسن، active 15th century,,human,Rajab ibn Ḥasan Maqarrī,Q131748433,DSNAME7589,Q68199,,,,
"Isfarāyīnī, Muḥammad ibn Muḥammad, -1285",author,اسفراييني، محمد بن محمد,,,,,,,human,Muḥammad ibn Muḥammad Isfarāyīnī,Q122947965,Q12287
"Ḥarīrī, 1054-1122",author,حريري,,,,,,,human,Abu al-Hariri,Q286097,Q12288
"Khalīlī, Muḥammad ibn ʻAbd al-Raḥmān",scribe,خليلي، محمد بن عبد الرحمن,,,,,,,,,,
"Ṣābūnī, Aḥmad ibn Maḥmūd, -1184",author,صابوني، احمد بن محمود، -1184,,,,,,,human,Nur al-Din al-Sabuni,Q25451999,Q12289
"Qurṭubī, Muḥammad ibn Aḥmad, -1273",author,قرطبي، محمد بن احمد,,human,Al-Qurtubi,Q1151805,DSNAME7590,Q68200,,,,
"Ibn al-Jawzī, Abū al-Faraj ʻAbd al-Raḥmān ibn ʻAlī, approximately 1116-1201",author,ابن الجوزي، ابو الفرج عبد الرحمن بن علي، approximately 1116-1201,http://id.loc.gov/authorities/names/n84008731,,,,,,human,Abu'l-Faraj ibn al-Jawzi,Q731866,Q12290
"Wāḥidī, Abū al-Ḥasan ʻAlī ibn Aḥmad, -1075 or 1076",author,واحدي ، أبو الحسن علي بن احمد,http://id.loc.gov/authorities/names/n85821906,,,,,,human,Wāḥidī Nīsābūrī,Q12227985,Q12291
"Sijistānī, Muḥammad ibn ʻUzayr, -941 or 942",author,سجستاني، محمد بن عزير,http://id.loc.gov/authorities/names/n88250931,,,,,,human,Muḥammad ibn ʻUzayr Sijistānī,Q122946980,Q12292
"Abū Shāmah, ʻAbd al-Raḥmān ibn Ismāʻīl, 1203-1267",author,ابو شامة، عبد الرحمن بن اسماعيل,http://id.loc.gov/authorities/names/n80137503,,,,,,human,Abu-Shama al-Maqdissí,Q481455,Q12293
"Khaṭīb al-Tibrīzī, Muḥammad ibn ʻAbd Allāh, active 1337",author,خطيب التبريزي، محمد بن عبد الله,,human,Muḥammad ibn ʻAbd Allāh Khatib Al-Tabrizi,Q105062495,DSNAME6332,Q49203,,,,
"Abū Nuʻaym al-Iṣbahānī, Aḥmad ibn ʻAbd Allāh, 948-1038",author,"ابو نعيم الاصبهاني، احمد بن عبد الله, 948-1038",,,,,,,human,Abu Nu`aym,Q2822174,Q12271
"Suhaylī, ʻAbd al-Raḥmān ibn ʻAbd Allāh, 1114 or 1115-1185",author,سهيلي، عبد الرحمن بن عبد الله,http://id.loc.gov/authorities/names/n85230420,,,,,,human,Al-Suhayli,Q4703267,Q12294
"Ibn Ḥajar al-ʻAsqalānī, Aḥmad ibn ʻAlī, 1372-1449",author,ابن حجر العسقلاني، احمد بن علي، 1372-1449,http://id.loc.gov/authorities/names/n82108960,,,,,,human,Ibn Hajar al-Asqalani,Q471116,Q12295
"Baghawī, al-Ḥusayn ibn Masʻūd, -1117",author,بغوي، الحسين بن مسعود,http://id.loc.gov/authorities/names/n81020342,,,,,,human,Al-Baghawi,Q48210,Q12296
"Ibn al-Kharrāṭ, ʻAbd al-Ḥaqq ibn ʻAbd al-Raḥmān, 1116 or 1117-1185",author,ابن الخراط، عبد الحق بن عبد الرحمن,http://id.loc.gov/authorities/names/nr92014850,,,,,,human,Ibn al-Kharrāṭ,Q12222548,Q12297
"Taftāzānī, Masʻūd ibn ʻUmar, 1322-1389",author,تفتازاني، مسعود بن عمر، 1322-1389,,,,,,,human,Taftazani,Q764947,Q12298
"Anṣārī, ʻAbd Allāh ibn Muḥammad, 1247 or 1248-1323 or 1324",author,"انصاري، عبد الله بن محمد, 1247 or 1248-1323 or 1324",http://id.loc.gov/authorities/names/nr90021710,,,,,,human,ʻAbd Allāh ibn Muḥammad Anṣārī,Q122946944,Q12299
"Jammāʻīlī, ʻAbd al-Ghanī ibn ʻAbd al-Wāḥid, 1146-1203",author,جماعيلي، عبد الغني بن عبد الواحد، 1146-1203,http://id.loc.gov/authorities/names/n84010934,,,,,,human,Molana Abdul Ghani Hanbhi,Q423563,Q12300
"Shādhilī, ʻAlī ibn ʻAlī, active 14th century",scribe,شاذلي، علي بن علي، active 14th century,,human,ʻAlī ibn ʻAlī Shādhilī,Q131748434,DSNAME7591,Q68201,,,,
"Quṭb al-Shīrāzī, Maḥmūd ibn Masʻūd, 1236 or 1237-1310 or 1311",author,قطب الشيرازي، محمود بن مسعود,,,,,,,human,Qutb al-Din al-Shirazi,Q729903,Q12301
"Rūmī, Aḥmad ibn ʻAbd al-Qādir, -1631",author,رومي، احمد بن عبد القادر، -1631,http://id.loc.gov/authorities/names/nr95013930,,,,,,human,Aḥmad Ibn-ʿAbd-al-Qāhir ar- Rūmī,Q113782405,Q12302
"Ṭabarī, ʻAbd al-Qādir ibn Muḥammad, 1568 or 1569-1623 or 1624",author,طبري، عبد القادر بن محمد، 1568 or 1569-1623 or 1624,http://id.loc.gov/authorities/names/nr91022340,,,,,,human,Abd al-Qadir al-Tabari,Q86075470,Q12303
"Ibn al-ʻImād al-Aqfahsī, Aḥmad, approximately 1349-1405",author,ابن العماد الاقفهسي، احمد، approximately 1349-1405,http://id.loc.gov/authorities/names/nr91043779,,,,,,human,Aḥmad Ibn al-ʻImād al-Aqfahsī,Q6537116,Q12304
"ʻIyāḍ ibn Mūsá, 1083-1149",author,عياض بن موسى,http://id.loc.gov/authorities/names/n83017679,,,,,,human,Qadi Ayyad,Q3101035,Q3786
"Ghazzālī, 1058-1111",author,غزالي، 1058-1111,http://id.loc.gov/authorities/names/n82097778,,,,,,human,Al-Ghazali,Q9546,Q12305
"Ibn Malak, ʻAbd al-Laṭīf ibn ʻAbd al-ʻAzīz",author,ابن ملك، عبد اللطيف بن عبد العزيز,,,,,,,human,ʻAbd al-Laṭīf ibn ʻAbd al-ʻAzīz ibn Malak,Q116418873,Q3794
"Muḥammad ibn Muṣṭafá, active 17th century",scribe,محمد بن مصطفى، active 17th century,,human,Muḥammad ibn Muṣṭafá,Q131748435,DSNAME7592,Q68202,,,,
"Iṣfahānī, Maḥmūd ibn ʻAbd al-Raḥmān, 1275 or 1276-1348 or 1349",author,اصفهاني، محمود بن عبد الرحمن، 1275 or 1276-1348 or 1349,http://id.loc.gov/authorities/names/nr91044051,,,,,,human,Mahmud ibn Abd al-Rahman al-Isfahani,Q57970695,Q12306
"Aqyāzatī, Muḥammad ibn ʻĪsá, active 15th century",scribe,اقيازتي، محمد بن عيسى، active 15th century,,human,Muḥammad ibn ʻĪsá Aqyāzatī,Q131748436,DSNAME7593,Q68203,,,,
"Jurjānī, ʻAlī ibn Muḥammad, al-Sayyid al-Sharīf, 1340-1413",author,جرجاني، علي بن محمد، السيد الشريف، 1340-1413,,,,,,,human,Ali ibn Mohammed al-Jurjani,Q3063378,Q12280
"Maḥbūbī, ʻUbayd Allāh ibn Masʻūd, -1346 or 1347",author,محبوبي، عبيد الله بن مسعود، -1346 or 1347,http://id.loc.gov/authorities/names/n86141596,,,,,,human,ʿUbaidallāh Ibn-Masʿūd al- Maḥbūbī,Q31313352,Q12307
"Nasafī, ʻAbd Allāh ibn Aḥmad, -1310",author,نسفي، عبد الله بن احمد، -1310,http://id.loc.gov/authorities/names/n82144374,,,,,,human,ʿAbdallāh Ibn-Aḥmad Nasafī,Q12223449,Q12308
"Shahrastānī, Muḥammad ibn ʻAbd al-Karīm, 1086?-1153",author,شهرستاني، محمد بن عبد الكريم,http://id.loc.gov/authorities/names/n83043209,,,,,,human,Al-Shahrastani,Q1050887,Q12309
"Maimonides, Moses, 1135-1204",author,,http://id.loc.gov/authorities/names/n78096039 http://id.loc.gov/authorities/names/n78096039 http://viaf.org/viaf/sourceID/LC%7cn78096039,,,,,,human,Moshe ben Maimon,Q127398,Q12310
"Ghunaymī, Aḥmad ibn Muḥammad, -1634",author,غنيمي، احمد بن محمد,http://id.loc.gov/authorities/names/n89188849 http://id.loc.gov/authorities/names/n89188849 http://viaf.org/viaf/sourceID/LC%7cn89188849,,,,,,human,Aḥmad ibn Muḥammad Ghunaymī,Q122946952,Q12311
"Ibn ʻArabī, Saʻd al-Dīn, 1222-1258",author,ابن عربي، سعد الدين، 1222-1258,,human,Saʻd al-Dīn Ibn ʻArabī,Q131398859,DSNAME7594,Q68204,,,,
"Sibāʻī, Muḥammad ibn Ṣāliḥ, -1851 or 1852",author,سباعي، محمد بن صالح,http://id.loc.gov/authorities/names/no2008028375,,,,,,human,Muḥammad ibn Ṣāliḥ Sibāʻī,Q122946979,Q12312
"Mallawī, ʻAbd al-Karīm Aḥmad",scribe,ملوي، عبد الكريم احمد,,,,,,,,,,
ʻAbd al-Raḥīm ibn ʻAbd al-Karīm,author,عبد الرحيم بن عبد الكريم,,human,ʻAbd al-Raḥīm ibn ʻAbd al-Karīm,Q131398860,DSNAME7595,Q68205,,,,
"Mawṣilī, ʻAbd Allāh ibn Maḥmūd, 1202 or 1203-1284",author,موصلي، عبد الله بن محمود، 1202 or 1203-1284,http://id.loc.gov/authorities/names/n85307246,,,,,,human,Abdullah Ibn Mahmud al-Mawsili,Q12238806,Q12313
"Ṣaghānī, al-Ḥasan ibn Muḥammad, 1181-1252",author,صغاني، الحسن بن محمد، 1181-1252,http://id.loc.gov/authorities/names/n84238396 http://id.loc.gov/authorities/names/n84238396 http://viaf.org/viaf/sourceID/LC%7cn84238396,,,,,,human,al-Ḥasan Ibn-Muḥammad Ṣaġānī,Q12186422,Q12314
"Zamakhsharī, Maḥmūd ibn ʻUmar, 1075-1144",author,"زمخشري، محمود بن عمر, 1075-1144",,,,,,,human,Al-Zamakhshari,Q482451,Q12315
"Jaydī, Burhān ibn ʻĀlam, active 14th century",scribe,"جيدي، برهان بن عالم, active 14th century",,human,Burhān ibn ʻĀlam Jaydī,Q131748437,DSNAME7596,Q68206,,,,
"Abū al-Faraj ʻAbd Allāh ibn al-Tayyib, -1043",author,ابو الفرج عبد الله بن الطيب,http://id.loc.gov/authorities/names/nr95024340,,,,,,human,Ibn al-Tayyib,Q2820894,Q12316
"Ibn Dallāj al-Maghribī, ʻAbd al-Wāḥid ibn Muḥammad",author,ابن دلاج المغربي، عبد الواحد بن محمد,http://id.loc.gov/authorities/names/no2008117969,,,,,,human,ʻAbd al-Wāḥid ibn Muḥammad Ibn Dallāj al-Maghribī,Q122946955,Q12317
"Ibn al-Kutubī, Yūsuf ibn Ismaʻīl, -approximately 1353",author,ابن الكتبي، يوسف بن اسمعيل,http://id.loc.gov/authorities/names/no2008118509,,,,,,human,Yusuf ibn Ismail al-Kutubi,Q6534413,Q12318
"Qūṣūnī, Madyan ibn ʻAbd al-Raḥmān, active 17th century",former owner,قوصوني، مدين بن عبد الرحمن,http://id.loc.gov/authorities/names/n80036282,,,,,,human,Madyan Qusuni,Q105338234,Q12319
"Ibn al-Fāriḍ, ʻUmar ibn ʻAlī, 1181 or 1182-1235",author,ابن الفارض، عمر بن علي,,,,,,,human,Ibn al-Farid,Q203142,Q12320
"Hüsrev, Molla, -1480",author,خسرو ملا,http://id.loc.gov/authorities/names/n88218446 http://id.loc.gov/authorities/names/n88218446 http://viaf.org/viaf/sourceID/LC%7cn88218446,,,,,,human,Molla Hüsrev,Q12244864,Q12321
"Yamamoto, Tsunetomo, 1659-1719",author,"山本常朝, 1659-1719",http://id.loc.gov/authorities/names/n50057435,,,,,,human,Yamamoto Tsunetomo,Q548162,Q12884
"Tanba, Muneyasu, 1505-1529",author,"丹波宗康, 1505-1529",,,,,,,human,"Tanba, Muneyasu",Q123006802,Q12885
Chūjo Chōan,author,中條長庵,,,,,,,human,Chūjo Chōan,Q123005780,Q12886
"Hanaoka, Seishū, 1760-1835",author,"華岡青洲, 1760-1835",http://id.loc.gov/authorities/names/n88091783,,,,,,human,Hanaoka Seishū,Q1376935,Q12887
"Ḥusaynī, Muḥammad ibn ʻAlī, active 18th century",author,حسيني، محمد بن علي، active 18th century,,human,Muḥammad ibn ʻAlī Ḥusaynī,Q131398861,DSNAME7597,Q68207,,,,
"Sujāʻī, Aḥmad ibn Aḥmad, -1783",author,سجاعي، احمد بن احمد، -1783,,,,,,,human,Aḥmad ibn Aḥmad Sujāʻī,Q122947967,Q12322
"Rashīdī, Aḥmad ʻArafah ibn Aḥmad ʻArafah",scribe,رشيدي، احمد عرفة بن احمد عرفة,,,,,,,,,,
"Ḥanbalī, Muḥammad ibn ʻAbd al-Laṭīf",scribe,حنبلي، محمد بن عبد اللطيف,,human,Muḥammad ibn ʻAbd al-Laṭīf Ḥanbalī,Q131398862,DSNAME7598,Q68208,,,,
"Darawī, Muḥammad Haykal, active 18th century",scribe,دروي، محمد هيكل، active 18th century,,human,Muḥammad Haykal Darawī,Q131748438,DSNAME7599,Q68209,,,,
"Mubarrad, Muḥammad ibn Yazīd, -898",author,مبرد، محمد بن يزيد، 898,,human,Al-Mubarrad,Q2829242,DSNAME7600,Q68210,,,,
"Abū Tammām Ḥabīb ibn Aws al-Ṭāʼī, active 808-842",author,ابو تمام حبيب بن اوس الطائي، active 808-842,,,,,,,human,Abu Tammam,Q1750054,Q12323
"Asadī, al-Ḥusayn ibn Muḍar, active 12th century",scribe,اسدي، الحسين بن مضر، active 12th century,,human,al-Ḥusayn ibn Muḍar Asadī,Q131748439,DSNAME7601,Q68211,,,,
"Khūjah, Muḥammad Aḥmad",scribe,خوجة، محمد احمد,,,,,,,,,,
"Simillāwī, ʻAbd al-Muʻṭī ibn Sālim, -1715",author,سملاوي، عبد المعطي بن سالم، 1715,,,,,,,human,ʻAbd al-Muʻṭī ibn Sālim Simillāwī,Q122947966,Q12324
ʻAlī ibn al-Muqrī,author,علي بن المقري,,,,,,,,,,
"Wāʻiẓ, Muḥammad ibn Salāmah",scribe,واعظ، محمد بن سلامة,,,,,,,,,,
"Ibn al-Rūmī, 836-896",author,ابن الرومي، 836-896,,,,,,,human,Ibn al-Rumi,Q3141116,Q12325
"Maʻmarī, Rabīʻah ibn Muḥammad, active 1009",author,معمري، ربيعة بن محمد، active 1009,,human,Rabīʻah ibn Muḥammad Maʻmarī,Q131398863,DSNAME7602,Q68212,,,,
"Kushājim, Maḥmūd ibn al-Ḥusayn, active 10th century",author,كشاجم، محمود بن الحسين، active 10th century,,human,Maḥmūd ibn al-Ḥusayn Kushājim,Q131398864,DSNAME7603,Q68213,,,,
Ibn al-Maqrūn,scribe,ابن المقرون,,,,,,,,,,
"Abū Firās al-Ḥamdānī, al-Ḥārith ibn Saʻīd, 932-968",author,ابو فراس الحمداني، الحارث بن سعيد، 932-968,,human,Abu Firas al-Hamdani,Q481409,DSNAME7604,Q68214,,,,
"Marṣafī, Muḥammad",scribe,مرصفي، محمد,,,,,,,,,,
"Anṣārī, Zakarīyā ibn Muḥammad, approximately 1423-approximately 1520",author,انصاري، زكريا بن محمد approximately 1423-approximately 1520,http://id.loc.gov/authorities/names/n85197808 http://id.loc.gov/authorities/names/n85197808 http://viaf.org/viaf/sourceID/LC%7cn85197808,,,,,,human,Zakariyya al-Ansari,Q4117458,Q12326
"Khilāf, Muḥammad ibn Muḥammad",scribe,خلاف، محمد بن محمد,,,,,,,,,,
"Abīwardī, Muḥammad ibn Aḥmad, -1113",author,ابيوردي، محمد بن احمد، -1113,,,,,,,human,Muḥammad ibn Aḥmad Abīwardī,Q30088060,Q12327
"Ṭughrāʼī, al-Ḥusayn ibn ʻAlī, 1061 or 1062-1121",author,طغرائي، الحسين بن علي، 1061 or 1062-1121,,,,,,,human,Al-Tughrai,Q4164865,Q12328
"Baḥraq, Muḥammad ibn ʻUmar, 1465-1524",author,"بحرق، محمد بن عمر, 1465-1524",,,,,,,human,Bahraq of Yemen,Q28713152,Q12329
"Ibn Rifāʻah al-Ghazzī, Ibrāhīm ibn Yaḥyá, -1130",author,ابن رفاعة الغزي، ابراهيم بن يحيى، -1130،,http://id.loc.gov/authorities/names/n2011211122,,,,,,human,Ibrāhīm ibn Yaḥyá Ibn Rifāʻah al-Ghazzī,Q122946957,Q12330
"ʻĀdilī, Muḥammad ibn Ṣadaqah, -approximately 1451",author,عادلي، محمد بن صدقة، -approximately 1451,,human,Muḥammad ibn Ṣadaqah ʻĀdilī,Q131398865,DSNAME7605,Q68215,,,,
"Ibn al-Nabīh, ʻAlī ibn Muḥammad, -1222 or 1223",author,ابن النبيه، علي بن محمد، -1222 or 1223,,human,ʿAlī Ibn-Muḥammad Ibn-an-Nabīh,Q6534697,DSNAME7606,Q68216,,,,
"Ḥillī, Rājiḥ ibn Ismāʻīl, 1174 or 1175-1229 or 1230",author,حلي، راجح بن اسماعيل، 1174 or 1175-1229 or 1230,,human,Rājiḥ ibn Ismāʻīl Ḥillī,Q131398866,DSNAME7607,Q68217,,,,
"Sakhāwī, ʻAlī ibn Tāj al-Dīn, active 17th century",scribe,سخاوي، علي بن تاج الدين، active 17th century,,human,ʻAlī ibn Tāj al-Dīn Sakhāwī,Q131748440,DSNAME7608,Q68218,,,,
"Ibn al-Muqarrab, ʻAlī, 1176 or 1177-1231 or 1232",author,ابن المقرب، علي، 1176 or 1177-1231 or 1232,,,,,,,human,Ali bin al Mugrab Al Uyuni,Q4725311,Q12331
"Sukkarī, ʻAbd al-Tawwāb",author,"سكري, عبد التواب",,,,,,,,,,
"Fāwī, Muḥammad Ibrāhīm",scribe,فاوي، محمد ابراهيم,,,,,,,,,,
"Shādhilī, Abū al-Ḥasan ʻAlī ibn ʻAbd Allāh, approximately 1196-1258",author,شاذلي، ابو الحسن علي بن عبد الله approximately 1196-1258,,,,,,,human,Abul Hasan ash-Shadhili,Q2704613,Q41652
"Warrāq, Muḥammad ibn ʻAbd al-ʻAzīz, -1281",author,وراق، محمد بن عبد العزيز، -1281,,human,Muḥammad ibn ʻAbd al-ʻAzīz Warrāq,Q131398867,DSNAME7609,Q68219,,,,
"Ibn al-Qaṣṣār al-Tūnisī, Aḥmad ibn Muḥammad, active 14th century",author,ابن القصار التونسي، احمد بن محمد، active 14th century,,human,Aḥmad ibn Muḥammad Ibn al-Qaṣṣār al-Tūnisī,Q131748441,DSNAME7610,Q68220,,,,
"Farḥūlī, Muḥammad ibn Aḥmad ibn Muḥammad ibn Makīn",scribe,فرحولي، محمد بن احمد بن محمد بن مكين,,,,,,,,,,
"Muṣannifak, ʻAlī ibn Majd al-Dīn Muḥammad, 1400 or 1401-1470 or 1471",author,مصنفك، علي بن مجد الدين محمد، 1400 or 1401-1470 or 1471,,,,,,,human,Ali al-Bistami,Q42343964,Q12332
"Qasṭallānī, Aḥmad ibn Muḥammad, 1447 or 1448-1517 or 1518",author,قسطلاني، احمد بن محمد، 1447 or 1448-1517 or 1518,,,,,,,human,Al-Qastallani,Q2829271,Q12333
"Nūsī, Ṣāliḥ",scribe,نوسي، صالح,,,,,,,,,,
"Ibn Ḥajar al-Haythamī, Aḥmad ibn Muḥammad, approximately 1503-approximately 1566",author,ابن حجر الهيثمي، احمد بن محمد، approximately 1503-approximately 1566,http://id.loc.gov/authorities/names/n82165741,,,,,,human,Ibn Hajar al-Haytami,Q3147445,Q12334
"Bulūkbāshī, Rajab ibn Muḥammad",scribe,بلوكباشي، رجب بن محمد,,,,,,,,,,
"Nābulusī, ʻAbd al-Ghanī ibn Ismāʻīl, 1641-1731",author,نابلسي، عبد الغني بن اسماعيل، 1641-1731,http://id.loc.gov/authorities/names/n83198301,,,,,,human,Abd al-Ghani al-Nabulsi,Q4164547,Q12278
"Shushtarī, ʻAlī ibn ʻAbd Allāh, 1213 or 1214-1269",author,ششتري، علي بن عبد الله، 1213 or 1214-1269,,,,,,,human,Abu al-Hasan al-Shushtari,Q4118240,Q12335
"Barakāt, Ḥasan ibn Maḥmūd, active 19th century",author,بركات، حسن بن محمود، active 19th century,,human,Ḥasan ibn Maḥmūd Barakāt,Q131398868,DSNAME7611,Q68221,,,,
"Wafā, Muḥammad, 1302 or 1303-1363",author,وفاء، محمد، 1302 or 3-1363,,human,Muḥammad Wafā,Q120599173,DSNAME7612,Q68222,,,,
"Badār al-Ṣaghīr, ʻAlī ibn Aḥmad",scribe,بدار الصغير، علي بن احمد,,,,,,,,,,
"Ṣafadī, Khalīl ibn Aybak, approximately 1297-1363",author,صفدي، خليل بن ايبك، approximately 1297-1363,,,,,,,human,"Ṣafadī, Khalīl ibn Aybak",Q12220160,Q12336
"Rashīdī, ʻAbd al-Raḥmān ibn Muḥammad, active 14th century",author,رشيدي، عبد الرحمن بن محمد، 14th century,,human,ʻAbd al-Raḥmān ibn Muḥammad Rashīdī,Q131748442,DSNAME7613,Q68223,,,,
"Qīrāṭī, Ibrāhīm ibn ʻAbd Allāh, 1326-1379 or 1380",author,قيراطي، ابراهيم بن عبد الله، 1326-1379,,human,Ibrāhīm ibn ʻAbd Allāh Qīrāṭī,Q131398869,DSNAME7614,Q68224,,,,
"Mālikī, Muḥammad ibn Aḥmad, active 15th century",scribe,مالكي، محمد بن احمد، active 15th century,,human,Muḥammad ibn Aḥmad Mālikī,Q131748443,DSNAME7615,Q68225,,,,
"Ibn Ḥijjah al-Ḥamawī, Taqī al-Dīn Abū Bakr ibn ʻAlī, -1434",author,ابن حجة الحموي، تقي الدين ابو بكر بن علي، 1434,,,,,,,human,Ibn Hijjah al-Hamawi,Q12202946,Q12337
"Ibn al-Muqrī, Ismāʻīl ibn Abī Bakr, 1354-1433 or 1434",author,ابن المقري، اسماعيل بن ابي بكر، 1354-1433 or 1434,,,,,,,human,Ismāʻīl ibn Abī Bakr Ibn al-Muqrī,Q28753992,Q54117
"Sammān, Muḥammad ibn ʻAbd al-Raḥmān",scribe,سمان، محمد بن عبد الرحمن,,,,,,,,,,
"Maḥallī, Muḥammad ibn Aḥmad, 1422 or 1423-1485 or 1486",author,محلي، محمد بن احمد، 1422 or 1423-1485 or 1486,,human,Muḥammad ibn Aḥmad Maḥallī,Q131398870,DSNAME7586,Q68196,,,,
"Ibn Khallūf, Aḥmad ibn Abī al-Qāsim, 1425-1493 or 1494",author,ابن خلوف، احمد بن ابي القاسم، -1493 or 1494,,,,,,,human,Shihāb al-Dīn ibn al-Khalūf,Q107178029,Q12338
"Bahnasī, Muḥammad ibn Muḥammad ibn ʻAbd al-Raḥmān, -1592 or 1593",author,بهنسي، محمد بن محمد بن عبد الرحمن، -1592 or 1593,,human,Muḥammad ibn Muḥammad ibn ʻAbd al-Raḥmān Bahnasī,Q131398871,DSNAME7616,Q68226,,,,
"Miṣrī, Ḥasanayn ibn Muḥammad",scribe,مصري، حسنين بن محمد,,,,,,,,,,
"Ḥamīdī, ʻAbd al-Raḥmān ibn Aḥmad ibn ʻAlī",author,حميدي، عبد الرحمن بن احمد بن علي,,,,,,,,,,
"Anbābī, Manṣūr",scribe,انبابي، منصور,,,,,,,,,,
"ʻInāyātī, Aḥmad ibn Aḥmad, 1525 or 1526-1605 or 1606",author,عناياتي، احمد بن احمد، 1525 or 1526-1605 or 1606,,human,Aḥmad ibn Aḥmad ʻInāyātī,Q131398872,DSNAME7617,Q68227,,,,
"Ibn al-Jazarī, Ḥusayn ibn Aḥmad, 1589-1624",author,ابن الجزري، حسين بن احمد، 1589-1624,,human,Ḥusayn ibn Aḥmad Ibn al-Jazarī,Q131398873,DSNAME7618,Q68228,,,,
"Ḥarīrī, Rajab ibn Ḥijāzī",scribe,حريري، رجب بن حجازي,,,,,,,,,,
"Abū al-Mawāhib, Muḥammad ibn Muḥammad, -1627 or 1628",author,ابو المواهب، محمد بن محمد، -1627 or 1628,,human,Muḥammad ibn Muḥammad Abū al-Mawāhib,Q131748444,DSNAME7619,Q68229,,,,
"Ibn Abī Numayy, Aḥmad ibn Masʻūd, -1632 or 1633",author,ابن ابي نمي، احمد بن مسعود، -1632 or 1633,,human,Aḥmad ibn Masʻūd Ibn Abī Numayy,Q131748445,DSNAME7620,Q68230,,,,
"Udkāwī, ʻAbd Allāh ibn ʻAbd Allāh, 1692 or 1693-1770 or 1771",scribe,ادكاوي، عبد الله بن عبد الله، 1692 or 1693-1770 or 1771,,,,,,,human,ʻAbd Allāh ibn ʻAbd Allāh Udkāwī,Q122947968,Q12339
"Baylūnī, Muḥammad Fatḥ Allāh ibn Maḥmūd, 1569 or 1570-1632 or 1633",author,بيلوني، محمد فتح الله بن محمود، 1569 or 1570-1632 or 1633,,human,Muḥammad ibn Fatḥ Allāh Baylūnī,Q131748503,DSNAME7693,Q68303,,,,
"Ibn al-Naḥḥās, Fatḥ Allāh ibn ʻAbd Allāh, -1642 or 1643",author,ابن النحاس، فتح الله بن عبد الله، -1642 or 1643,,,,,,,human,Ibn an-Nahhas al-Halabi,Q86204655,Q12340
"Karīmī, Muḥammad ibn Yūsuf, 1599 or 1600-1657 or 1658",author,كريمي، محمد بن يوسف، 1599 or 1600-1657 or 1658,,human,Muḥammad ibn Yūsuf Karīmī,Q131748446,DSNAME7621,Q68231,,,,
"Ibn Maʻtūq, Shihāb al-Dīn, 1616 or 1617-1676 or 1677",author,ابن معتوق، شهاب الدين، 1616 or 1617-1676 or 1677,,,,,,,human,Abu Maʻtuq al-Musawi,Q6537777,Q12341
"Binhādī, Ḥ̣asan ibn Sulaymān",scribe,بنهادي، حسن بن سليمان,,,,,,,,,,
"ʻArawdak, Abū Bakr ibn Fityān, -1273",author,عرودك، ابو بكر بن فتيان، 1273-,,human,Abū Bakr ibn Fityān ʻArawdak,Q131748447,DSNAME7622,Q68232,,,,
"ʻUryānī, ʻUthmān ibn ʻAbd Allāh, -1753 or 1754",author,عرياني، عثمان بن عبد الله، -1753 or 1754,,human,ʻUthmān ibn ʻAbd Allāh ʻUryānī,Q131398874,DSNAME7623,Q68233,,,,
"Shabrāwī, ʻAbd Allāh ibn Muḥammad, 1680 or 1681-1757 or 1758",author,شبراوي، عبد الله بن محمد، 1680 or 1681-1757 or 1758,,human,ʻAbd Allāh ibn Muḥammad Shabrāwī,Q131398875,DSNAME7624,Q68234,,,,
