title_as_recorded,title_as_recorded_agr,uniform_title_as_recorded,uniform_title_as_recorded_agr,authorized_label_add,authorized_label
Ādāb al-baḥth ... etc,آداب البحث ... الخ.,,,Ādāb al-baḥth,
Akhbār Miṣr wa-mā khaṣṣahā Allāh bi-hi min al-faḍl wa-al-barakāt wa-al-khayrāt,اخبار مصر وما خصها الله به من الفضل والبرکات والخيرات.,,,,
al-Aḍwā' al-bahijah fī ibrāz daqāʼiq al-Munfarijah,الاضواء البهجة في ابراز دقايق المنفرجة.,,,al-Aḍwā' al-bahijah fī ibrāz daqāʼiq al-Munfarijah,
al-Ajwibah al-Nāṣirīyah /,الاجوبة الناصرية /,Ajwibah al-Nāṣirīyah fī baʻḍ masāʼil al-bādiyah,اجوبة الناصرية في بعض المسائل البادية,Ajwibah al-Nāṣirīyah fī baʻḍ masāʼil al-bādiyah,
al-Anwār al-qamarīyah sharḥ al-Qaṣīdah al-Maqqarīyah,الانوار القمرية شرح القصيدة المقرية.,,,al-Anwār al-qamarīyah sharḥ al-Qaṣīdah al-Maqqarīyah,
al-Awwal al-thālith min Kitāb al-Tahdhīb fī ikhtiṣār Kitāb al-Tahdhīb tahdhīb al-kamāl fī asmāʼ al-rijāl jamaʻa al-Shaykh al-Imām al-Ḥāfiẓ Abī al-Ḥujjaj Yūsuf ibn al-Zakī ʻAbd al-Raḥmān ibn Yūsuf al-Mizzī al-Kalbī ... /,"الاول الثالث من كتاب التهذيب في اختصار كتاب التهذيب تهذيب الكمال في اسماء
				الرجال /","Tahdhīb fī ikhtiṣār Kitāb al-Tahdhīb tahdhīb al-kamāl fī asmāʼ
				al-rijāl",تهذيب في اختصار كتاب التهذيب تهذيب الكمال في اسماء الرجال,Tahdhīb fī ikhtiṣār Kitāb al-Tahdhīb tahdhīb al-kamāl fī asmāʼ al-rijāl,
al-Awwal min al-ʻInāyah sharḥ al-Hidāyah,الاول من العناية شرح الهداية.,ʻInāyah ʻalá al-Hidāyah,عناية على الهداية,ʻInāyah ʻalá al-Hidāyah,
al-Dhukhr,الذخر.,,,Dhukhr,
al-Durr al-mukhtār fī sharḥ Tanwīr al-abṣār /,الدر المختار في شرح تنوير الابصار /,,,Durr al-mukhtār fī sharḥ Tanwīr al-abṣār,
al-Durr al-munaẓẓam fī madḥ al-ḥabīb al-aʻẓam,الدر المنظم في مدح الحبيب الاعظم.,,,Durr al-munaẓẓam fī madḥ al-ḥabīb al-aʻẓam,
al-Durr al-muntaẓam bi-al-shiʻr al-multazam fī madḥ al-Nabī /,الدر المنتظم بالشعر الملتزم في مدح النبي /,,,Durr al-muntaẓam bi-al-shiʻr al-multazam fī madḥ al-Nabī,
al-Farāyid al-Burhānīyah fī taḥqīq al-Fawāyid al-Fanārīyah,الفرايد البرهانية في تحقيق الفوايد الفنارية.,Farāʼid al-Burhānīyah fī taḥqīq al-Fawāʼid al-Fanārīyah,فرائد البرهانية في تحقيق الفوائد الفنارية,Farāʼid al-Burhānīyah fī taḥqīq al-Fawāʼid al-Fanārīyah,
al-Fawākih al-Badrīyah fī al-aqḍiyah al-ḥukmīyah,الفواكه البدرية في الاقضية الحكمية.,,,Fawākih al-Badrīyah fī al-aqḍiyah al-ḥukmīyah,
al-Fawāyid al-ghazīrah fī ḥadīth Barīrah,الفوايد الغزيره في حديث بريره.,Fawāʼid al-ghazīrah fī ḥadīth Barīrah.,فوائد الغزيرة في حديث بريرة.,Fawāʼid al-ghazīrah fī ḥadīth Barīrah,
al-Fawāʼid al-Fanārīyah ... etc,الفوائد الفنارية ... الخ.,,,Fawāʼid al-Fanārīyah,
Alfīyah al-Ṭayyibah ... etc,الفية الطيبة ... الخ.,,,,
al-Futūḥāt al-rabbānīyah fī hazīmat al-Faransāwīyah,الفتوحات الربانية في هزيمة الفرنساوية.,,,Futūḥāt al-rabbānīyah fī hazīmat al-Faransāwīyah,
al-Ḥadhāqah fī anwāʻ al-ʻalāqah /,الحذاقة في انواع العلاقة.,,,Ḥadhāqah fī anwāʻ al-ʻalāqah,
al-Ḥawāshī al-mujammaʻah min sharḥ al-aḥādīth al-muttabaʻah /,الحواشى المجمعة من شرح الاحاديث المتبعه /,Minhāj al-muḥaddithīn.,منهاج المحدثين.,Minhāj al-muḥaddithīn,
al-Hayʼah al-sanīyah,الهيئة السنية.,Hayʼah al-sanīyah fī al-hayʼah al-sunnīyah,هيئه السنية في الهيئه السنية,Hayʼah al-sanīyah fī al-hayʼah al-sunnīyah,
al-Ḥudūd li-abwāb al-fiqh,الحدود لابواب الفقه.,,,Ḥudūd li-abwāb al-fiqh,
al-Īḍāḥ ... etc,الايضاح ... الخ,,,Īḍāḥ,
al-Īḍāḥ fī al-waqf wa-al-ibtidāʼ /,الايضاح في الوقف والابتدى /,,,Īḍāḥ fī al-waqf wa-al-ibtidāʼ,
al-Ijāzah,الاجازة.,,,Ijāzah,
al-Intibāh li-muʻālajat al-bāh ... etc,الانتباه لمعالجة الباه ... الخ.,,,Intibāh li-muʻālajat al-bāh,
al-Intiṣār,الانتصار.,,,Intiṣār,
al-Jalīs al-laṭīf wa-al-nadīm al-ẓarīf ... etc,الجليس اللطيف والنديم الظريف ... الخ.,,,Jalīs al-laṭīf wa-al-nadīm al-ẓarīf,
al-Jazl al-muʻtamad al-mufīd,الجزل المعتمد المفيد.,,,Jazl al-muʻtamad al-mufīd,
al-Juzʼ al-akhīr fī tafsīr al-Qurʼān al-ʻaẓīm /,الجزؤ الاخير في تفسير القرآن العظيم /,Kashf wa-al-bayān ʻan tafsīr al-Qurʼān,كشف والبيان عن تفسير القرآن,Kashf wa-al-bayān ʻan tafsīr al-Qurʼān,
al-Juzʼ al-awwal al-sābiʻ min Naẓm al-laʼālī fī al-miʼah al-ʻawālī al-mukhrajah lil-Burhān al-Shāmī /,"الجزء الاول السابع من نظم اللألي في المائة العوالي المخرجة للبرهان الشامي
				/",Naẓm al-laʼālī fī al-miʼah al-ʻawālī,نظم اللألي في المائة العوالي,Naẓm al-laʼālī fī al-miʼah al-ʻawālī,
al-Juzʼ al-awwal min al-fawāʼid al-sanīyah fī sharḥ al-Alfīyah al-uṣūlīyah /,الجزء الاول من الفوائد السنية في شرح الالفية الاصولية /,Fawāʼid al-sanīyah fī sharḥ al-Alfīyah.,فوائد السنية في شرح الالفية.,Fawāʼid al-sanīyah fī sharḥ al-Alfīyah,
al-Juzʼ al-awwal min al-Kashshāf ʻan ḥaqāʼiq ghawāmiḍ al-tanzīl wa-ʻuyūn al-aqāwīl fī wujūh al-taʼwīl /,"الجزء الاول من الكشاف عن حقائق غوامض التنزيل وعيون الاقاويل في وجوه التأويل
				/","Kashshāf ʻan ḥaqāʼiq ghawāmiḍ al-tanzīl wa-ʻuyūn al-aqāwīl fī wujūh
				al-taʼwīl",کشاف عن حقائق غوامض التنزيل وعيون الاقاويل في وجوه التأويل,Kashshāf ʻan ḥaqāʼiq ghawāmiḍ al-tanzīl wa-ʻuyūn al-aqāwīl fī wujūh al-taʼwīl,
al-Juzʼ al-awwal min al-Maṣābīḥ /,الجزء الاول من المصابيح /,Maṣābīḥ al-sunnah.,مصابيح السنة,Maṣābīḥ al-sunnah,
al-Juzʼ al-awwal min al-Turjumān,الجزء الاول من الترجمان.,Turjumān.,ترجمان.,Turjumān,
al-Juzʼ al-awwal min Kitāb al-Aghānī,الجزء الاول من كتاب الاغاني.,Kitāb al-Aghānī.,كتاب الاغاني.,Kitāb al-Aghānī,
al-Juzʼ al-awwal min Kitāb Jawāhir al-ʻuqūd wa-muʻīn al-quḍāh wa-al-muwaqqiʻīn wa-al-shuhūd /,"الجزؤ الاول من كتاب جواهر العقود ومعين القضاه والموقعين والشهود
				/","Jawāhir al-ʻuqūd wa-muʻīn al-quḍāh wa-al-muwaqqiʻīn
				wa-al-shuhūd.",جواهرالعقود وميعن القضاة والموقعين والشهود.,Jawāhir al-ʻuqūd wa-muʻīn al-quḍāh wa-al-muwaqqiʻīn wa-al-shuhūd,
al-Juzʼ al-awwal min mukhtaṣar Sharḥ Muslim sharḥ al-Imām ... shaykh al-Islām Muḥyī al-Dīn al-Nawāwī ikhtiṣār al-Shaykh al-imām al-ʻālim al-fāḍil Jamāl al-Dīn ʻAbd Allāh ibn Shams al-Dīn Muḥammad al-Anṣarī al-Shāfiʻī al-Ḥalabī raḥimahu Allāh taʻālá wa-huwa bi-khaṭṭ muʼallifih,"الجزء الاول من مختصر شرح مسلم شرح الامام ... شيخ الاسلام محيي الدين
				النواوي اختصار الشيخ الامام العالم الفاضل جمال الدين عبد الله بن شمس الدين محمد
				الانصري الشافعي الحلبي رحمه الله تعالى وهو بخط مؤلفه",Talkhīṣ Sharḥ Ṣaḥīḥ Muslim.,تلخيص شرح صحيح مسلم.,Talkhīṣ Sharḥ Ṣaḥīḥ Muslim,
al-Juzʼ al-awwal min Sharḥ al-Bahjah /,الجزؤ الاول من شرح البهجة /,Bahjah al-marḍīyah.,بهجة المرضية.,Bahjah al-marḍīyah,
al-Juzʼ al-awwal min Sīrat al-Ḥalabī,الجزؤ الاول من سيرة الحلبي,Sīrah al-Ḥalabīyah,سيرة الحلبية,Sīrah al-Ḥalabīyah,
al-Juzʼ al-awwal min Zād al-masīr fī ʻilm al-tafsīr /,الجزء الاول من زاد المسير في علم التفسير /,Zād al-masīr fī ʻilm al-tafsīr.,زاد المسير في علم التفسير.,Zād al-masīr fī ʻilm al-tafsīr,
al-Juzʼ al-rābiʻ min al-Aḥkām al-kubrá /,الجزء الرابع من الاحكام الكبرى /,Aḥkām al-sharʻīyah al-kubrá.,احكام الشرعية الكبرى.,Aḥkām al-sharʻīyah al-kubrá,
al-Juzʼ al-rābiʻ min Ghawāmiḍ al-fikar fī tartīb masāyil al-Minhāj ʻalá al-mukhtaṣar /,الجز الرابع من غوامض الفكر في ترتيب مسايل المنهاج على المختصر /,Ghawāmiḍ al-fikar fī tartīb masāʼil al-Minhāj ʻalá al-mukhtaṣar.,غوامض الفکر في ترتيب مسائل المنهاج على المختصر.,Ghawāmiḍ al-fikar fī tartīb masāʼil al-Minhāj ʻalá al-mukhtaṣar,
al-Juzʼ al-rābiʻ min Kitāb al-Kawkab al-munīr bi-sharḥ al-Jāmiʻ al-ṣaghīr /,الجزء الرابع من كتاب الكوكب المنير بشرح الجامع الصغير /,Kawkab al-munīr bi-sharḥ al-Jāmiʻ al-ṣaghīr.,کوکب المنير بشرح الجامع الصغير.,Kawkab al-munīr bi-sharḥ al-Jāmiʻ al-ṣaghīr,
al-Juzʼ al-rābiʻ min Sharḥ Kitāb al-Durrah al-bahīyah fī al-masāyil al-fiqhīyah /,الجز الرابع من شرح كتاب الدرة البهية في المسايل الفقهية /,Sharḥ al-Durrah al-bahīyah fī al-masāʼil al-fiqhīyah.,شرح الدرة البهية في المسائل الفقهية.,Sharḥ al-Durrah al-bahīyah fī al-masāʼil al-fiqhīyah,
al-Juzʼ al-rābiʻ min Tafsīr al-wasīṭ /,الجزء الرابع من تفسير الوسيط /,Wasīṭ bayna al-maqbūd wa-al-basīṭ.,وسيط بين المقبود والبسيط.,Wasīṭ bayna al-maqbūd wa-al-basīṭ,
al-Juzʼ al-thālith min Kitāb al-Burhān fī ʻulūm al-Qurʼān /,الجزء الثالث من كتاب البرهان في علوم القرآن /,Burhān fī ʻulūm al-Qurʼān,برهان في علوم القرآن,Burhān fī ʻulūm al-Qurʼān,
al-Juzʼ al-thālith min Kitāb al-Rawḍah al-ṭālibīn wa-ʻumdat al-muftīyīn /,الجزء الثالث من كتاب الروضة الطالبين وعمدة المفتيين /,Rawḍat al-ṭālibīn wa-ʻumdat al-muftīn.,روضة الطالين وعمدة المفتين.,Rawḍat al-ṭālibīn wa-ʻumdat al-muftīn,
al-Juzʼ al-thālith min Kitāb al-Wāḍiḥ fī uṣūl al-fiqh ʻalá madhhab al-Imām Abī ʻAbd Allāh Aḥmad ibn Muḥammad ibn Ḥanbal /,"الجز الثالث من كتاب الواضح في اصول الفقه على مذهب الامام ابي عبد الله احمد
				بن محمد بن حنبل /",Wāḍiḥ fī uṣūl al-fiqh.,واضح في اصول الفقه.,Wāḍiḥ fī uṣūl al-fiqh,
al-Juzʼ al-thālith min Sharḥ al-Muḥarrar /,الجزؤ الثالث من شرح المحرر /,Sharḥ al-Muḥarrar.,شرح المحرر.,Sharḥ al-Muḥarrar,
al-Juzʼ al-thānī min al-Rawḍ al-unuf /,الجزء الثاني من الروض الانف /,Rawḍ al-unuf.,روض الانف,Rawḍ al-unuf,
al-Juzʼ al-thānī min al-Taḥrīr fī sharḥ al-Jāmiʻ al-kabīr /,الجزء الثاني من التحرير في شرح الجامع الكبير /,Taḥrīr fī sharḥ al-Jāmiʻ al-kabīr.,تحرير في شرح الجامع الكبير.,Taḥrīr fī sharḥ al-Jāmiʻ al-kabīr,
al-Juzʼ al-thānī min Kitāb al-Tibyān fī tafsīr al-Qurʼān /,الجزء الثاني من كتاب التبيان في تفسير القرآن /,Tibyān fī tafsīr al-Qurʼān,تبيان في تفسير القرآن,Tibyān fī tafsīr al-Qurʼān,
al-Juzʼ al-thānī min Kitāb Ḥilyat al-awliyāʼ wa-ṭabaqat al-aṣfiyāʼ /,الجزء الثاني من كتاب حلية الاوليا وطبقة الاصفيا /,Ḥilyat al-awliyāʼ.,حلية الاولياء.,Ḥilyat al-awliyāʼ,
al-Juzʼ al-Thānī min Kitāb Jāmiʻ aḥkām al-Qurʼān wa-al-mubīn limā taḍammana min al-sunnah wa-ayy al-furqān /,"الجزء الثاني من كتاب جامع احكام القرآن والمبين لما تضمن من السنة واي
				الفرقان /",Jāmiʻ li-aḥkām al-Qurʼān.,جامع لاحكام القرآن.,Jāmiʻ li-aḥkām al-Qurʼān,
al-Juzʼ al-thānī min Sharḥ al-Shāṭibīyah,الجزء الثاني من شرح الشاطبية,Ibrāz al-maʻānī min Ḥirz al-amānī.,ابراز المعاني من حرز الاماني.,Ibrāz al-maʻānī min Ḥirz al-amānī,
al-Juzʼ al-thānī min Sharḥ Ṣaḥīḥ al-Bukhārī /,الجزء الثاني من شرح صحيح البخاري /,Sharḥ Ṣaḥīḥ al-Bukhārī.,شرح صحيح البخاري.,Sharḥ Ṣaḥīḥ al-Bukhārī,
al-Juzʼ al-thānī min Tasʹhīl al-hidāyah wa-taḥṣīl al-Kifāyah /,الجزء الثاني من تسهيل الهداية وتحصيل الكفاية /,Tasʹhīl al-hidāyah wa-taḥṣīl al-Kifāyah.,تسهيل الهداية وتحصيل الکفاية.,Tasʹhīl al-hidāyah wa-taḥṣīl al-Kifāyah,
al-Kashfīyah ʻalá Sharḥ al-ʻAḍudīyah ... etc,الكشفية على شرح العضدية ... الخ.,,,Kashfīyah ʻalá Sharḥ al-ʻAḍudīyah,
al-Kawākib al-durrīyah ʻalá al-Arbaʻīn al-Jawharīyah /,الكواكب الدرية على الاربعين الجوهرية /,,,Kawākib al-durrīyah ʻalá al-Arbaʻīn al-Jawharīyah,
al-Khulāṣah,الخلاصة.,Sharḥ Alfīyat Ibn Mālik,شرح على الفية ابن مالك في علم العربية,Sharḥ Alfīyat Ibn Mālik,
al-Khulāṣah fī maʻrifat al-ḥadīth ... etc,الخلاصة في معرفة الحديث ... الخ.,,,Khulāṣah fī maʻrifat al-ḥadīth,
al-Kitāb al-mabsūṭ,الکتاب المبسوط.,Mabsūṭ,مبسوط,Mabsūṭ,
al-Laṭāyif al-nūrīyah fī al-minaḥ al-Damanhūrīyah,اللطايف النورية في المنح الدمنهورية.,,,Laṭāyif al-nūrīyah fī al-minaḥ al-Damanhūrīyah,
al-Lumʻah al-sanīyah fī ḥall alfāẓ al-Ājurrūmīyah,اللمعة السنية في حل الفاظ الاجرومية.,,,Lumʻah al-sanīyah fī ḥall alfāẓ al-Ājurrūmīyah,
al-Lumʻah fī ajwibat al-asʼilah al-sabʻah /,اللمعة في اجوبة الاسئلة السبعة /,,,Lumʻah fī ajwibat al-asʼilah al-sabʻah,
al-Lumʻah fī khuṣūṣīyāt yawm al-Jumʻah /,اللمعة في خصوصيات يوم الجمعة /,,,Lumʻah fī khuṣūṣīyāt yawm al-Jumʻah,
al-Luʼluʼ al-naẓīm /,اللؤلؤ النظيم /,Luʼluʼ al-naẓīm fī rawm al-taʻallum wa-al-taʻlīm,لؤلؤ النظيم في روم التعلم والتعليم,Luʼluʼ al-naẓīm fī rawm al-taʻallum wa-al-taʻlīm,
al-Maḥāsin al-mujtamaʻah fī faḍl faḍāyil al-khulafāʼ al-arbaʻah /,المحاسن المجتمعة في فضل فضايل الخلفاء الاربعة /,,,Maḥāsin al-mujtamaʻah fī faḍl faḍāyil al-khulafāʼ al-arbaʻah,
al-Manāhij al-wāfiyah fī sharḥ al-Shāfiyah /,المناهج الوافية في شرح الشافية /,,,Manāhij al-wāfiyah fī sharḥ al-Shāfiyah,
al-Manhaj al-mubīn fī sharḥ al-Arbaʻīn,المنهج المبين في شرح الاربعين.,,,Manhaj al-mubīn fī sharḥ al-Arbaʻīn,
al-Manhal al-sākib fī maʻrifat taḥrīk al-kawākib,المنهل الساکب في معرفة تحريك الکواکب.,,,Manhal al-sākib fī maʻrifat taḥrīk al-kawākib,
al-Manhal al-ʻadhb al-mustaṭāb fī kayfīyat al-ʻamal bi-al-asṭurlāb /,المنهل العذب المستطاب في كيفية العمل بالاسطرلاب /,,,Manhal al-ʻadhb al-mustaṭāb fī kayfīyat al-ʻamal bi-al-asṭurlāb,
al-Manẓūmah al-Nasafīyah fī al-khilāfīyāt,المنظومة النسفية في الخلافيات.,,,Manẓūmah al-Nasafīyah fī al-khilāfīyāt,
al-Maqṣūrah al-Duraydīyah wa-sharḥuhā,المقصورة الدريدية وشرحها.,,,Maqṣūrah al-Duraydīyah wa-sharḥuhā,
al-Mawāhib al-mudhdhakharah fī tafsīr khawātim Sūrat al-Baqarah /,المواهب المذخرة في تفسير خواتم سورة البقرة /,,,Mawāhib al-mudhdhakharah fī tafsīr khawātim Sūrat al-Baqarah,
al-Minhāj fī sharḥ Muslim ibn al-Ḥajjāj,المنهاج في شرح مسلم بن الحجاج.,,,Minhāj fī sharḥ Muslim ibn al-Ḥajjāj,
al-Mudawwanah,المدونة.,Mudawwanah.,مدونة.,Mudawwanah,
al-Mufarrij,المفرج.,,,Mufarrij,
al-Mufaṣṣal /,المفصل /,,,Mufaṣṣal,
al-Muhadhdhab fī al-hijāʼ min dhayl Shifāʼ al-qurrāʼ,المهذب في الهجاء من ذيل شفاء القراء.,,,Muhadhdhab fī al-hijāʼ min dhayl Shifāʼ al-qurrāʼ,
al-Muḥīṭ ʻalá madhhab al-Imām al-Aʻẓam Abī Ḥanīfah al-Nuʻmān ibn Thābit,المحيط على مذهب الامام الاعظم ابي حنيفة النعمان بن ثابت.,Muḥīṭ,محيط,Muḥīṭ,
al-Mujallad al-thānī min Kitāb al-Kāfī fī al-fiqh /,المجلد الثاني من كتاب الكافي في الفقه /,Kāfī fī al-fiqh.,کافي في الفقه.,Kāfī fī al-fiqh,
al-Munaqqaḥāt al-mashrūḥah,المنقحات المشروحة.,,,Munaqqaḥāt al-mashrūḥah,
al-Munqidh ʻan al-ḍalāl /,المنقذ عن الضلال /,Munqidh min al-ḍalāl,منقذ من الضلال,Munqidh min al-ḍalāl,
al-Muṭawwal,المطول.,,,Muṭawwal,
al-Muʻjam al-wajīz min aḥādīth al-Rasūl al-ʻazīz,المعجم الوجيز من احاديث الرسول العزيز.,,,Muʻjam al-wajīz min aḥādīth al-Rasūl al-ʻazīz,
al-Naṣīḥah al-īmānīyah fī faḍīḥat al-millah al-Naṣrānīyah,النصيحة الايمانية في فضيحة الملة النصرانية.,,,Naṣīḥah al-īmānīyah fī faḍīḥat al-millah al-Naṣrānīyah,
al-Nuzʹhah al-zahīyah fī aḥkām al-ḥammām al-sharʻīyah wa-al-ṭibbīyah /,النزهة الزهية في احكام الحمام الشرعية والطبية /,,,Nuzʹhah al-zahīyah fī aḥkām al-ḥammām al-sharʻīyah wa-al-ṭibbīyah,
al-Qānūn fī al-ṭibb,القانون في الطب,,,Qānūn fī al-ṭibb,
al-Qaṣīdah al-mubārakah,القصيدة المباركة,Burdah,بردة,Burdah,
al-Qaṣīdah al-mulaqqabah bi-Ḥirz al-amānī wa-wajh al-tahānī,القصيدة الملقبة بحرز الاماني ووجه التهاني,Ḥirz al-amānī wa-wajh al-tahānī,حرز الاماني ووجه التهاني,Ḥirz al-amānī wa-wajh al-tahānī,
al-Qawl al-maqbūl fīmā yuddaʻá fīhi bi-al-majhūl /,القول المقبول فيما يدعي فيه بالمجهول /,,,Qawl al-maqbūl fīmā yuddaʻá fīhi bi-al-majhūl,
al-Qism al-thānī min Yatīmat al-dahr fī shuʻarāʼ al-ʻaṣr /,القسم الثاني من يتيمة الدهر في شعراء العصر /,Yatīmat al-dahr.,يتيمة الدهر.,Yatīmat al-dahr,
al-Qurʼān,القرآن.,Qurʼan.,قرآن.,,Qurʼan
al-Qurʼān,,Qurʼan.,قرآن.,,Qurʼan
al-Radd al-muṣān li-mā aftá bi-hi Riḍwān,الرد المصان لما افتى به رضوان.,,,Radd al-muṣān li-mā aftá bi-hi Riḍwān,
al-Rawḍ al-unuf /,الروض الانف /,,,Rawḍ al-unuf,
al-Risālah al-istidlālīyah ... etc,الرسالة الاستدلالية ... الخ..,,,Risālah al-istidlālīyah,
al-Risālah al-jiddīyah li-Ibn Zaydūn al-Andulusī wa-sharḥuhā /,الرسالة الجدية لابن زيدون الاندلسي وشرحها /,,,Risālah al-jiddīyah li-Ibn Zaydūn al-Andulusī wa-sharḥuhā,
al-Ṣaḥīfah al-ʻabqarīyah fī al-uṣūl al-manṭiqīyah,الصحيفة العبقرية في الاصول المنطقية.,,,Ṣaḥīfah al-ʻabqarīyah fī al-uṣūl al-manṭiqīyah,
al-Sāmi fī al-asāmī,السامي في الاسامي.,,,Sāmi fī al-asāmī,
al-Samīr al-anīs idha ghuliba al-muḥibb wa-al-jalīs,السمير الانيس اذ غلب المحب والجليس :,,,Samīr al-anīs idha ghuliba al-muḥibb wa-al-jalīs,
al-Ṣuḥbah /,الصحبة /,Munīf al-rutbah li-man thabata la-hu sharīf al-ṣuḥbah,منيف الرتبة لمن ثبت له شريف الصحبة,Munīf al-rutbah li-man thabata la-hu sharīf al-ṣuḥbah,
"al-Sunan al-māthūrah ʻan Rasūl Allāh, ṣallá Allāh ʻalayhi wa-salam /",السنن الماثورة عن رسول الله، صلى الله عليه وسلم /,Mujtabá,مجتبى,Mujtabá,
al-Taḥdīth ʻan nāzilat al-ḥadīth,التحديث عن نازلة الحديث.,,,Taḥdīth ʻan nāzilat al-ḥadīth,
al-Takhmīs /,التخميس /,,,Takhmīs,
al-Tanqīḥ wa-ghayrih,التنقيح وغيره.,,,Tanqīḥ wa-ghayrih,
al-Tarjamah al-ʻabqarīyah wa-al-ṣawlah al-ḥaydarīyah lil-Tuḥfah al-Ithnay ʻAsharīyah,الترجمة العبقرية والصولة الحيدرية للتحفة الاثني عشرية.,Tuḥfah-ʼi Is̲nay ʻAsharīyah.,تحفۀ اثنى عشرية.,Tuḥfah-ʼi Is̲nay ʻAsharīyah,
al-Taṣānīf fī iṣṭilāḥ ahl al-athar ... etc,التصانيف في اصطلاح اهل الاثر ... الخ.,,,Taṣānīf fī iṣṭilāḥ ahl al-athar,
al-Tāsiʻ min Kitāb al-Bukhārī,التاسع من كتاب البخاري.,Jāmiʻ al-ṣaḥīḥ.,جامع الصحيح.,Jāmiʻ al-ṣaḥīḥ,
al-Tawḍīḥ fī ḥall ghawāmiḍ al-Tanqīḥ,التوضيح في حل غوامض التنقيح.,,,Tawḍīḥ,
al-Tawḍīḥ fī ḥall ghawāmiḍ al-Tanqīḥ,التوضيح في حل غوامض التنقيح,Tawḍīḥ,توضيح,Tawḍīḥ,
al-Thānī min Kitāb Rawḍ al-unuf fī sharḥ mushkilāt alfāẓ Sīrat al-Nabī ṣallá Allāh ʻalayhi wa-sallam /,"الثاني من كتاب روض الانف في شرح مشكلات الفاظ سيرة النبي صلى الله عليه وسلم
				/",Rawḍ al-unuf,روض الانف,Rawḍ al-unuf,
al-Wāfiyah fī sharḥ al-Kāfiyah,الوافية في شرح الکافية.,,,Wāfiyah fī sharḥ al-Kāfiyah,
al-Wajīz fī al-uṣūl,الوجيز في الاصول.,,,Wajīz fī al-uṣūl,
al-Zahr al-fāyiq fī mawlid ashraf al-khalāyiq /,الزهر الفايق في مولد اشرف الخلايق /,Zahr al-fāʼiq fī mawlid ashraf al-khalāʼiq,زهر الفائق في مولد اشرف الخلائق,Zahr al-fāʼiq fī mawlid ashraf al-khalāʼiq,
al-Zīj al-jadīd,الزيج الجديد.,,,Zīj al-jadīd,
al-ʻIqd al-farīd lil-Malik al-Saʻīd,العقد الفريد للملك السعيد.,,,ʻIqd al-farīd lil-Malik al-Saʻīd,
al-ʻUjālah al-wāfiyah fī al-siyāsah al-dīnīyah wa-al-dunyawiyah wa-aḥkām al-firāsah al-ḥukmīyah /,"العجالة الوافية في السياسة الدينية والدنيوية واحكام الفراسة الحكمية
				/",,,ʻUjālah al-wāfiyah fī al-siyāsah al-dīnīyah wa-al-dunyawiyah wa-aḥkām al-firāsah al-ḥukmīyah,
al-ʻUmdah fī al-aḥkām fī al-ḥadīth /,العمدة في الاحكام في الحديث /,ʻUmdat al-aḥkām,عمدة الاحكام,ʻUmdat al-aḥkām,
Amthilah ... etc,امثلة ... الخٍ,,,,
Anwār al-tanzīl wa-asrār al-taʼwīl,انوار التنزيل واسرار التأويل.,,,Anwār al-tanzīl wa-asrār al-taʼwīl,
Arabic miscellany,,,,Arabic miscellany,
Arabic-Turkish vocabulary,,,,Arabic-Turkish vocabulary,
Arabic-Turkish vocabulary ... etc,,,,Arabic-Turkish vocabulary,
Ashraf al-wasāyil ilá fahm al-Shamāyil /,اشرف الوسايل الى فهم الشمايل /,Ashraf al-wasāʼil ilá fahm al-Shamāʼil,اشرف الوسائل الى فهم الشمائل,Ashraf al-wasāʼil ilá fahm al-Shamāʼil,
Asmāʼ al-rijāl min al-ṣaḥābah wa-al-tābiʻīn,اسماء الرجال من الصحابة والتابعين.,Ikmāl fī asmāʼ al-rijāl,اكمال في اسماء الرجال,Ikmāl fī asmāʼ al-rijāl,
Astronomical miscellany,,,,Astronomy,
Āṭah'li ve Zeynîzade ve Birgivî şerhi,آطه‌لي وزيني‌زادة وبرغي شرح.,,,,
Badīʻīyah,بديعية.,,,Badīʻīyah,
Badīʻīyah /,بديعية /,,,Badīʻīyah,
Badr al-majāmīʻ,بدر المجاميع.,,,Badr al-majāmīʻ,
Bidāyat al-qārī fī khatm Ṣaḥīḥ al-Bukhārī,بداية القاري في ختم صحيح البخاري.,,,,
Chronica de rebus Glastoniensis,,Cronica,,Chronica de rebus Glastoniensis,
Collection of Arabic commentaries and glosses,,,,Arabic commentaries,
Collection of Arabic poems,,,,Arabic poems,
Collection of Arabic poems and miscellany,,,,Arabic poems,
Collection of Arabic stories and sayings,,,,Arabic stories,
Collection of Arabic tales,,,,Arabic stories,
Collection of Arabic texts,,,,Arabic texts,
Collection of Arabic texts in three fragments,,,,Arabic texts,
