DS12784,"","",marc-xml,"",Q54115,Wellesley College,in00000625703,MS 26,https://libcat.wellesley.edu/Record/in00000625703,"",Italy,Q134,14--,1400,15,http://vocab.getty.edu/aat/300404465,false,"Psalter, Breviary","","","",Q660;Q657,Manuscripts|Armorial bookplates,Q331|Q16277,"Breviaries--Texts|Psalters--Texts|Manuscripts, Latin (Medieval and modern)--Massachusetts--Wellesley",Q3593;Q3066|Q4323;Q3066|Q10783;Q68117,"","","","","","","","","","","","","Bolton, John|Minns, Susan",|,Q54689|Q20190,lat,Q113,parchment,Q33,Extent: 459 leaves : parchment ; 179 x 127 (110 x 84) mm,"Title supplied by cataloger.|Collation: Parchment. 18−1, 210−1, 36, 48−2, 5-88−1, 98−5, 108, 112, 128−1, 13-368, [lacking quire 37], 38-468, 478−1; lacking fol. 1-19, 36, 43, 49, 55, 63, 70, 79, 83, 85, 87, 89, 90, 101, 301-309 (quire 37), 384, and an unknown number of folios at end. Signatures in modern pencil on first recto of each quire. Catchwords preserved. Contemporary foliation in red roman numerals, predating text losses.|Layout: 1 column, 32 lines. Writing lines in brown plummet.|Script: Written in an Italian Gothic hand in black ink. Red rubrics.|Decoration: Three 5-line gold initials with diapered infill and scrolling acanthus leaves in margin (fol. 80v, 81v, 82v). The missing folios were probably illuminated with similar initials; the offprint of the gilt initial on the missing folio 101 is visible on fol. 100v. 3-line initials throughout alternate red with blue filigree or blue with red filigree.|Origin: Written in Italy in the fifteenth century, possibly for the use of a community of fratrum minorum.|Armorial bookplate of John Bolton inside front cover.","",2026-06-02 14:57:12 -0400,20241204,20260421-wellesley-marc.xml
DS12786,"","",marc-xml,"",Q54115,Wellesley College,in00000625705,MS 28,https://libcat.wellesley.edu/Record/in00000625705,"",N. France (Arras?),Q1114;Q7504,between 1450 and 1499,1450^1499,15,http://vocab.getty.edu/aat/300404465,false,"Book of Hours, use of Rome","","","",Q795,Manuscripts|Books of hours,Q331|Q38439,"Books of hours--Texts--Early works to 1800|Books of hours--Texts--Early works to 1800|Manuscripts, Latin (Medieval and modern)--Massachusetts--Wellesley",Q5889;Q3066;Q300|Q5889;Q3066;Q300|Q10783;Q68117,"","","","","","","","","","","","","","","",lat,Q113,parchment,Q33,Extent: 122 leaves : parchment ; 173 x 126 (105 x 74) mm,"Title supplied by cataloger.|Collation: Parchment. 1-26, 36−1, 4-88, 98−1, 108, 118+2, 12-168; cancels after fol. 17 and [55], fol. 79 and 80 are singletons. Some catchwords preserved. Modern pencil foliation skips fol. 19 and 25 and so reaches 120 instead of 122, but used here for reference.|Layout: 1 column, 15 lines. Bounding lines full-length, bounding and writing lines in red ink, some prickings preserved along outer and lower edge.|Script: Written in a Gothic bookhand in black ink. Red rubrics.|Decoration: Seven 4-line initials in salmon or blue on gold background with white-vine infill and grotesques, 3/4 borders of vines and scrolling acanthus in gold and colors with birds and grotesques; 2-line gold initials throughout filled with blue on salmon background or gold filled with salmon on blue background; initials in text alternate blue with red, or gold with blue or brown; line-fillers blue and gold, some with red as well. Six half-page miniatures: fol. 13: Crucifixion (for Hours of the Cross); fol. 18: Virgin and Child (for Vespers, Hours of the Virgin); fol. 31: Annunciation (for Matins); fol. 51: Visitation (for Lauds); fol. 81: Resurrection of the Dead (for the Penitential Psalms); fol. 97: Funeral procession (for the Office of the Dead; this miniature is damaged, or possibly incomplete)|Origin: Written in Northern France in the late fifteenth century. A possible origin in Arras is indicated by use of the Office of the Dead and the calendar (St. Vedast of Arras (10/1) and his translation (7/15) are both indicated in red on dates peculiar to Arras)|Eighteenth-century owners' portraits on clasps. Two nineteenth-century English dealer's descriptions pasted inside front cover.","",2026-06-02 14:57:12 -0400,20250409,20260421-wellesley-marc.xml
DS12790,"","",marc-xml,"",Q54115,Wellesley College,in00000625976,MS 30,https://libcat.wellesley.edu/Record/in00000625976,"",Rouen,Q1244,between 1450 and 1499,1450^1499,15,http://vocab.getty.edu/aat/300404465,false,"Book of Hours, Use of Rouen","","","",Q795,Manuscripts|Books of hours|illuminated manuscripts,Q331|Q38439|Q4268,"Books of hours--Texts--Early works to 1800|Books of hours--Texts--Early works to 1800|Manuscripts, Latin (Medieval and modern)--Massachusetts--Wellesley",Q5889;Q3066;Q300|Q5889;Q3066;Q300|Q10783;Q68117,"","","","","","","","","","","","","Dyckman, Fannie Fredericka, -1951","",Q54691,lat,Q113,parchment,Q33,"Extent: i, 66, i leaves : parchment ; 161 x 113 (92 x 57) mm","Title supplied by cataloger.|Collation: Parchment. 110, 28, 36, 410, 56, 610, 7-88. Modern pencil foliation.|Layout: 1 column, 20 lines. Bounding lines full-length, bounding and writing lines in red ink.|Script: Written in a bâtarde bookhand in brown ink. Red rubrics.|Decoration: Numerous 2- to 4-line white, gold, and salmon initials on background of gold ink, the larger ones historiated with foliage or fruit; verse initials alternate gold on red or gold on blue, as do line fillers; outer border on every page of scrolling acanthus, fruit, flowers, animals and grotesques on gold ink background. Eight 3/4-page miniatures: fol. 1: John on Patmos (for gospel reading of St. John); fol. 11: Annunciation (for Matins of the Hours of the Virgin); fol. 25: Crucifixion (for Hours of the Cross); fol. 26: Pentecost (for Hours of the Holy Spirit); fol. 27: Nativity (for Prime of the Hours of the Virgin); fol. 38: Flight into Egypt (for Vespers); fol. 44: King David and Nathan (for the Penitential Psalms); fol. 57v: Job on the dungheap (for the Office of the Dead)|Origin: Written in Rouen in the late fifteenth century. An origin in Rouen is indicated by the use of the Hours of the Virgin, and by the illustration of the fortified quai of Rouen in the background of the miniature on fol. 1 (John of Patmos)|Nineteenth-century British catalogue description pasted onto verso of rear flyleaf. Inscription on front flyleaf, ""F. Freda Dyckman/ from/ Her mother/ Oct. 8th 1895/ London.""","",2026-06-02 14:57:12 -0400,20241204,20260421-wellesley-marc.xml
DS12774,"","",marc-xml,"",Q54115,Wellesley College,in00000626089,P900,https://libcat.wellesley.edu/Record/in00000626089,https://repository.wellesley.edu/node/36228/manifest,Northern Italy,Q7507,between 1400 and 1450,1400^1450,15,http://vocab.getty.edu/aat/300404465,false,Paradiso,"","","",Q39575,Manuscripts,Q331,"Wellesley College Library. Plimpton Collection.--Manuscript.--900|Heaven--Poetry|Manuscripts, Italian--Massachusetts--Wellesley",Q67999;Q331|Q4909;Q247|Q269;Q68117,"Dante Alighieri, 1265-1321","",Q40500,"","","","","","","","","","","","",ita,Q116,parchment,Q33,"Extent: 1 leaf : parchment ; 301 x 213 (204 x 85 [text], 233 x 155 [text and commentary]) mm","With anonymous commentary, the ""Falso Boccaccio.""|Parchment.|Layout: 1 column with commentary in outer and lower margins, 30 lines of text, 54-56 lines of commentary. Bounding and writing lines blind ruled, outer and inner margins double-ruled.|Script: Written in a Humanistic bookhand, with a smaller module used for the commentary in black ink. Red rubrics.|Decoration: Two four-line initials in red and blue with brown and red infill and blue and red filigree into margins.|Origin: Written in Northern Italy in the first half of the fifteenth century.|Used as a flyleaf in the sixteenth century.","",2026-06-02 14:57:12 -0400,20241204,20260421-wellesley-marc.xml
DS12777,"","",marc-xml,"",Q54115,Wellesley College,in00000626431,P946,https://libcat.wellesley.edu/Record/in00000626431,https://repository.wellesley.edu/node/33362/manifest,Northern France or Flanders,Q1114;Q126,between 1400 and 1450,1400^1450,15,http://vocab.getty.edu/aat/300404465,false,De vita solitaria /,"","","",Q54680,Manuscripts,Q331,"Wellesley College Library. Plimpton Collection.--Manuscript.--946|Solitude--Early works to 1800|Manuscripts, Latin (Medieval and modern)--Massachusetts--Wellesley",Q67999;Q331|Q8117;Q300|Q10783;Q68117,"Peter Damian, Saint, 1007?-1072","",Q839,"","","","","","","","","","Phillipps, Thomas, Sir, 1792-1872","",Q385,lat,Q113,parchment,Q33,Extent: 95 (of 96) leaves : parchment ; 198 x 140 (138 x 95) mm,"Title supplied by cataloger.|Collation: Parchment. 1-118, 128−1, lacking one folio after fol. ""91"" (not 2 folios as in de Ricci and Jackson). Signed a - m. Catchwords preserved. Seventeenth-century foliations skips [90], but preceded folio loss, so reaches ""93"" at fol. 91. Modern pencil foliation is correct.|Layout: 1 column, 29 lines. Bounding and ruling lines in brown plummet, first and last lines ruled double, prickings preserved.|Script: Written in a Gothic bookhand in black ink. Marginal rubrics are black, in-text are red.|Decoration: Three 6-line initials in blue and red with red and purple infill and filigree into margin, chapters begin with 2-line red initials.|Origin: Written in Northern France or Flanders at the beginning of the fifteenth century. According to de Ricci, believed to have come from the monastery of Marienmunster. Belonged ca. 1600 to Henning.|Leander von Ess collection, Darmstadt, sold in 1824 to Sir Thomas Phillipps, his n. 429 with Middle Hill stamp on front flyleaf; his sale (London, 1910, n. 655) to Edwards.","",2026-06-02 14:57:12 -0400,20250409,20260421-wellesley-marc.xml
DS12785,"","",marc-xml,"",Q54115,Wellesley College,in00000626073,P1187,https://libcat.wellesley.edu/Record/in00000626073,https://repository.wellesley.edu/node/36466/manifest,Italy,Q134,14--,1400,15,http://vocab.getty.edu/aat/300404465,false,I trionfi,"","","",Q19996,Manuscripts|illuminated manuscripts,Q331|Q4268,"Wellesley College Library. Plimpton Collection.--Manuscript.--1187|Italian language--Poetry--Early works to 1800|Manuscripts, Italian--Massachusetts--Wellesley",Q67999;Q331|Q48274;Q247;Q300|Q269;Q68117,"Petrarca, Francesco, 1304-1374","",Q16486,"","","","","","","","","","Plimpton, George A. 1855-1936|Plimpton, Francis T. P. 1900-1983",|,Q16572|Q54690,ita,Q116,parchment,Q33,"Extent: iii, 46, iii leaves : parchment ; 150 x 91 (90 x 43) mm","Collation: Parchment. 1-410, 56 [probably 58−2, since quire is signed e1-4]. First half of quires signed a1 ... a5-e1 ... e4. Foliated in s. XIX brown ink in arabic numerals.|Decoration: Six 3-line gold-leaf initials (for Trionfi 1, 5, 7, 10, 13, and 14) filled with blue or salmon with white highlighting in a salmon or blue frame. One 6-line gold-leaf initial, folio 1r, filled with white-vine on a blue background extending into upper and left margin, decorated with gold buds and filled in colors, historiated with winged cupid holding a bow and shooting an arrow. In the lower margin, space for arms left blank surrounded by white-vine on blue background with gold buds and filled in colors.|Layout: 1 column, 24 lines. Double bounding lines, full-length to all sides, bounding and writing lines in blind, prickings for bounding and writing lines.|Origin: Written in Italy in the mid-fifteenth century.|Script: Written in an Italian Gothic bookhand in brown ink, partially faded. Spaces for rubrics left blank.|Nineteenth-century dealer's catalogue description inside front cover. Owned by George A. Plimpton.","",2026-06-02 14:57:12 -0400,20241204,20260421-wellesley-marc.xml
DS12788,"","",marc-xml,"",Q54115,Wellesley College,in00000626091,MS Ege 2,https://libcat.wellesley.edu/Record/in00000626091,"",France,Q122,11--,1100,12,http://vocab.getty.edu/aat/300404504,false,"Leaf from Bible, II Chronicles 29:10 ""et avertat""-31:4","",Bible,"",Q661;Q54682,Manuscripts,Q331,"Bible. Chronicles, 2nd|Manuscripts, Latin (Medieval and modern)--Massachusetts--Wellesley",Q27301|Q10783;Q68117,"","","","","","","","","","","","","","","",lat,Q113,parchment,Q33,Extent: 1 leaf : parchment ; 263 x 185 (203 x 136) mm,"Title supplied by cataloger.|Parchment.|Layout: 2 columns (60 mm each), 48 lines. Bounding lines full-length on all sides, doubled at top and bottom, bounding and writing lines in brown plummet, prickings preserved along inner margin.|Script: Written in a late romanesque script (written below top line) in brown ink. Red rubrics.|Decoration: 2-line initials green with red filigree or blue with red filigree.|Origin: Written in France in the mid-twelfth century.|Nr. 2 in the Otto Ege fragment set ""Original leaves from famous Bibles.""","",2026-06-02 14:57:12 -0400,20241204,20260421-wellesley-marc.xml
DS12789,"","",marc-xml,"",Q54115,Wellesley College,in00000626094,MS Ege A,https://libcat.wellesley.edu/Record/in00000626094,"",Germany,Q131,10--,1000,11,http://vocab.getty.edu/aat/300404503,false,"Leaf from Bible, Matthew 15-16","",Bible,"",Q661;Q1389,Manuscripts,Q331,"Bible. Matthew|Manuscripts, Latin (Medieval and modern)--Massachusetts--Wellesley",Q5898|Q10783;Q68117,"","","","","","","","","","","","","","","",lat,Q113,parchment,Q33,Extent: 1 leaf: parchment ; 195 x 272 [originally approximately 390 x 275] (172 x 217 [originally approximately 245 x 217]) mm,"Title supplied by cataloger.|Parchment. Lower half of one folio.|Layout: 2 columns (100 mm each), 22 lines. Bounding lines doubled along outer margin and between columns, bounding and writing lines in blind.|Script: Written in a late caroline minuscule script in brown ink. Red rubrics.|Decoration: Initials are red epigraphic capitals.|Origin: Written in Germany in the mid-eleventh century.|Housed with the Otto Ege fragment set ""Original Leaves from Famous Bibles"", but was not originally part of this set.","",2026-06-02 14:57:12 -0400,20241204,20260421-wellesley-marc.xml
DS12769,"","",marc-xml,rda,Q54115,Wellesley College,in00000671672,MS Arabic 2,https://libcat.wellesley.edu/Record/in00000671672,https://repository.wellesley.edu/node/35380/manifest,"","",1580,1580,16,http://vocab.getty.edu/aat/300404510,true,Ḥilyat al-rijāl,حلية الرجال,"","",Q54679,Manuscripts,Q331,"Hadith|Manuscripts, Arabic|Hadith|Manuscripts, Arabic",Q3581|Q256|Q3581|Q256,"Âli, Mustafa bin Ahmet, 1541-1599",عالى، مصطفى بن احمد. 1541-1599,Q54683,"","","","","","","","","","","","",ara,Q118,paper,Q31,Extent: 95 pages : paper ; 19 x 9.5 cm,"Manuscript codex.|Copy by the scribe Muṣtaf Nuzhat of a 1580 work by Muṣṭafā ibn Aḥmed, possibly about the Hadith of the Prophet.|49 leaves, paginated 1-95, skipping one opening between pages 70-71.|Written in black ink on paper, rubricated in red, gilt text borders, decorated title-page head piece and two miniatures at the end.|Black ink stamp on 1r.|Pencil annotations in Arabic on upper pastedown and upper and lower old paper wrappers.|Purchased by Curtis Runnels from an antiquarian bookshop in the Sahaflarcarsisi (Antiquarian book market) in Istanbul, September 1995.","",2026-06-02 14:57:12 -0400,20241204,20260421-wellesley-marc.xml
DS12773,"","",marc-xml,rda,Q54115,Wellesley College,in00000671684,MS Arabic 3,https://libcat.wellesley.edu/Record/in00000671684,https://repository.wellesley.edu/node/35491/manifest,"Cairo, Egypt",Q3093;Q3086,approximately 1480,1480,15,http://vocab.getty.edu/aat/300404465,false,"Arabic manuscript about a waqf, from the Mamluk Sultanate, Cairo, Egypt","","","",Q38349,Sources|Manuscripts,Q2769|Q331,"Qāʼit Bāy, Sultan of Egypt and Syria, -1496|Qāʼit Bāy, Sultan of Egypt and Syria, -1496|Waqf--Egypt--History|Endowments--Egypt--History--Sources|Charitable uses, trusts, and foundations--Egypt|Mamelukes|Manuscripts, Arabic|Mamelukes|Manuscripts, Arabic|Charitable uses, trusts, and foundations|Endowments|History|Waqf|Egypt",Q7771|Q7771|Q11403;Q11259;Q6879|Q18342;Q11259;Q6879;Q2769|Q10795;Q11259|Q11415|Q256|Q11415|Q256|Q10795|Q18342|Q6879|Q11403|Q11259,"Qāʼit Bāy, Sultan of Egypt and Syria, -1496",قايتباي، سلطان مصر وسوريا،، -1496,Q54684,"","","","","","","","","","","","",ara,Q118,paper,Q31,Extent: 1 volume (various pagings) : paper ; 21.5 x 16 cm,"Manuscript codex, incomplete.|Black ink on paper, rubricated in red, blue, brown, and gold.|15 leaves, paginated 3-14, 17-20, [21-22], 23-33, [34]. First leaf, last leaves, and one in the middle wanting.|Purchased by Curtis Runnels from Bruce Ferrini (d. 2010), Cleveland, Ohio, 1995.","",2026-06-02 14:57:12 -0400,20241204,20260421-wellesley-marc.xml
DS12771,"","",marc-xml,rda,Q54115,Wellesley College,in00000671653,MS Greek 1,https://libcat.wellesley.edu/Record/in00000671653,"",Greece?,Q16421,1600s,1600^1699,17,http://vocab.getty.edu/aat/300404511,false,Compilation of Greek texts,"","","",Q11984,Manuscripts|Sermons,Q331|Q180,"Orthodox Eastern Church--Liturgy--Manuscripts|Orthodox Eastern Church--Sermons--Manuscripts|Orthodox Eastern Church|Philosophy--Manuscripts|Christian saints--Biography--Manuscripts|Manuscripts, Greek|Philosophy--Manuscripts|Philosophy|Liturgics|Manuscripts|Manuscripts, Greek",Q4266;Q207;Q38609|Q4266;Q38598;Q38609|Q4266|Q17488|Q10812;Q27365;Q331|Q3512|Q17488|Q5883|Q207|Q38609|Q3512,"","","","","","","","","","","","","","","",Some in modern Greek,Q38096,paper,Q31,Extent: 442 pages in various pagings : paper ; 20 x 15 cm,"Title supplied by cataloger.|Manuscript codex, incomplete.|Various texts in several different hands. On folio 2r, text begins, ""Diēgēsis philosophía..."" (narrative or statement of philosophy). Other texts appear to be mainly liturgical, e.g., menaia, doxologia, martyrologia, etc.|Page 152: crown watermark ca. 1450 (Briquet, 4832-4835)?|Black ink on laid paper; rubricated in red; decorated initials and head pieces.|Signatures: 18, 22, 38, 42, 5-134, 14-168, 17-194, 208−1, 21-258, 264, 27-306, 31-368, 3710−4 ; fol. 9, 10, 99, 216-219 are singletons.|Pagination in ink from different periods (irregular): 1 leaf, 2-35, 38-41, 52-195, 198-455.|Layout: 1 column, number of lines per page vary.|Some water damage and missing text on first few folios.|Ownership inscriptions, some dated 1733, 1752, 1895. Page 311 has ownership inscription in Greek in pencil in margin, partly illegible: T[?] K. Lagoudas, 25 November 1895.|Purchased by Curtis Runnels from D. and E. Lake (Toronto, Canada) booksellers in December 2001.","",2026-06-02 14:57:12 -0400,20251114,20260421-wellesley-marc.xml
DS12772,"","",marc-xml,rda,Q54115,Wellesley College,in00000671654,MS Greek 2,https://libcat.wellesley.edu/Record/in00000671654,"",Greece?,Q16421,between 1450 and 1699,1450^1699,15;16;17,http://vocab.getty.edu/aat/300404465;http://vocab.getty.edu/aat/300404510;http://vocab.getty.edu/aat/300404511,false,Compilation of Greek liturgical texts,"","","",Q11984;Q6055,Manuscripts|Liturgical books|Hymns,Q331|Q5822|Q6878,"Orthodox Eastern Church--Liturgy--Manuscripts|Orthodox Eastern Church--Liturgy--Texts--Manuscripts|Orthodox Eastern Church|Manuscripts, Greek|Liturgics|Manuscripts|Manuscripts, Greek",Q4266;Q207;Q38609|Q4266;Q207;Q3066;Q331|Q4266|Q3512|Q207|Q38609|Q3512,"","","","","","","","","","","","","","","",gre,Q1318,paper,Q31,Extent: 214 leaves : paper ; 21 x 15 cm,"Title and variant title devised by cataloger.|Manuscript codex, incomplete.|Various texts, mainly liturgical, e.g., doxologia.|Fol. 107/112: scissors watermark ca. 1450 (Briquet, 3666)|Drawings in black ink on fol. 178v, 179r, 182v, 187v.|Signatures: 18, 24, 3-48, 510−1, 6-88, 94, 1012, 11-138, 146−1, 15-1712, 186−1, 19-208, 2110, 228, 236, 2412, 256, 2610−7 + 6 unnumbered leaves, likely from the beginning; fol. 44, 115, 167-170 + 4 unnumbered leaves are singletons.|Foliation in black ink from an early period: 13-113, 115-223, 6 leaves (numbered corners wanting)|Brown ink on laid paper, written in three different hands; rubricated in red; decorated initials and head pieces.|Layout: 1 column, number of lines per page vary.|Beginning, end, and some leaves in the middle wanting. Some water damage.|In several different hands. The first of text seems to date from the sixteenth century. The second text is older and from the fifteenth century.|Purchased by Curtis Runnels from D. and E. Lake (Toronto, Canada) booksellers in December 2001.","",2026-06-02 14:57:12 -0400,20251114,20260421-wellesley-marc.xml
,"","",marc-xml,"",Q54115,Wellesley College,in00000641796,MS MELA 1,https://libcat.wellesley.edu/Record/in00000641796,https://repository.wellesley.edu/node/47162/manifest,"","",1844.,1844,19,http://vocab.getty.edu/aat/300404513,true,Koran,"","","",Q3697,Autobiographies|Autobiographies,Q42538|Q42538,"","",Ali al-Khlusi,"","","","","","","","","","","","","","",Arabic,Q118,"","",Extent: 21 x 13 cm,"Text written in black ink with a border of red, blue, and gold. Unwan and two pages of surat Maryam are illuminated. Also some ornamentation in the margins.","",2026-06-02 14:57:12 -0400,20240625,20260421-wellesley-marc.xml
,"","",marc-xml,"",Q54115,Wellesley College,in00000641797,MS MELA 2,https://libcat.wellesley.edu/Record/in00000641797,https://repository.wellesley.edu/node/47780/manifest,"","",1815.,1815,19,http://vocab.getty.edu/aat/300404513,true,Koran,"","","",Q3697,Manuscripts|naskhī,Q331|Q3579,"Qurʼan--Texts|Qur'an--Manuscripts--19th century--Specimens|Manuscripts, Arabic--Massachusetts--Wellesley",Q11441;Q3066|Q11441;Q38609;Q3538;Q239|Q256;Q68117,Muhammad Hilmi,"","","","","","","","","","","","","","",In Arabic,Q118,"","",Extent: 15.5 x 10.5 cm,"Written in naskh script. Text in black ink with a border of red, blue, and gold. First two pages and last page illuminated. Some ornamentation in margins.|Bequest of Mrs. Alexander M. Welch to Wellesley College on 25 September 1951.","",2026-06-02 14:57:12 -0400,20241203,20260421-wellesley-marc.xml
,"","",marc-xml,"",Q54115,Wellesley College,in00000641798,MS MELA 3,https://libcat.wellesley.edu/Record/in00000641798,"","","",1800,1800,19,http://vocab.getty.edu/aat/300404513,false,Prayers and stories,"","","",Q5966,"","",Islam--Prayers and devotions,Q3549;Q3052,"","","","","","","","","","","","","","","",In Arabic,Q118,"","",Extent: 43 leaves ; 8 x 9.5 cm,"Written in maghribi script on both sides of small, loose paper. Brown ink with headings written in blue.|18-- to 19--|Contains several surat and other prayers and stories. Text ends abruptly.","",2026-06-02 14:57:12 -0400,20241107,20260421-wellesley-marc.xml
,"","",marc-xml,"",Q54115,Wellesley College,in00000641799,MS MELA 4,https://libcat.wellesley.edu/Record/in00000641799,"",According to note included with the manuscript it was obtained in North Africa near Oran,Q3652;Q114387,1800,1800,19,http://vocab.getty.edu/aat/300404513,false,Prayers and ejaculations,"","","",Q5966,"","",Islam--Prayers and devotions,Q3549;Q3052,"","","","","","","","","","","","","","","",In Arabic,Q118,"","",Extent: 9.3 x 9.5 cm,"Written in maghribi script on small, loose paper. Headings are in color. Two miniatures representing the mihrab al-salat and gabr al-nabiy are included in the second half.|18-- or 19--","",2026-06-02 14:57:12 -0400,20241107,20260421-wellesley-marc.xml
,"","",marc-xml,rda,Q54115,Wellesley College,in00000671624,MS Arabic 1,https://libcat.wellesley.edu/Record/in00000671624,https://repository.wellesley.edu/node/22428/manifest,"","",late 19th century or early 20th century,1800^1999,19;20,http://vocab.getty.edu/aat/300404513;http://vocab.getty.edu/aat/300404514,false,Dalāʼil al-khayrāt wa-shawāriq al-anwār,دلائل الخيرات وشوارق الانوار,Dalāʼil al-khayrāt,دلائل الخيرات,Q18568,Prayers|Prayers|Devotional literature|Devotional literature,Q38528|Q38528|Q38696|Q38696,"Muḥammad, Prophet, -632--Early works to 1800|Muḥammad, Prophet, -632--Companions|Muḥammad, Prophet, -632|Islam--Prayers and devotions--Early works to 1800|Prayer--Islam--Early works to 1800|Manuscripts, Arabic|Early works to 1800|Prayer--Islam|Manuscripts, Arabic|Islam--Prayers and devotions",Q3639;Q300|Q11256|Q3639|Q3549;Q3052;Q300|Q11135;Q300|Q256|Q300|Q11135|Q256|Q3036,"Jazūlī, Muḥammad ibn Sulaymān, 1404-1465",جزولي، محمد بن سليمان. 1404-1465,Q18651,"","","","","","","","","","","","",In Arabic,Q118,"paper, color illustrations",Q31,"Extent: 301 leaves : paper, color illustrations ; 12 x 12 cm","Manuscript codex.|Layout: 8 lines, border-ruled.|Decoration and illustrations in blue, yellow, red, and green.|Purchased in Morocco by the donor.","",2026-06-02 14:57:12 -0400,20250418,20260421-wellesley-marc.xml
,"","",marc-xml,rdadcrmmss,Q54115,Wellesley College,in00000681229,MS Arabic 4,https://libcat.wellesley.edu/Record/in00000681229,"",Central Asia,Q42470,18th century,1700,18,http://vocab.getty.edu/aat/300404512,false,Tashrīḥ al-aflāk,تشريح الافلاك,"","",Q11935,Tables (documents)|Scientific illustrations (images)|Stamps|Leather bindings,Q252|Q11377|Q3075|Q5843,"Early works to 1800|Astronomy, Arab--Early works to 1800|Astronomy, Arab|Manuscripts, Arabic|Manuscripts, Arabic",Q300|Q3035;Q300|Q3035|Q256|Q256,"ʻĀmilī, Bahāʼ al-Dīn Muḥammad ibn Ḥusayn, 1547-1621",عاملي، بهاء الدين محمد بن حسين، 1547-1621,Q12408,"","","","","","","","","","","","",ara,Q118,paper,Q31,Extent: 7 leaves : paper ; 247 x 152 (240-190 x 120-140) mm bound to 258 x 160 mm (26 cm),"Extensive marginal and interlinear notes and glosses. Astronomical diagrams in red and black (fol. 1b, 2a, 3a-b, 4a-b, 6a-b, 7a). Tables (fol. 5b).|Collation: Paper ; fol. 7 ; catchwords.|Layout: varies, longest page: 22 lines.|Fol. 1a and 7b blank.|Manuscript on polished oriental paper; in Arabic; 12 pages on 7 folios.","",2026-06-02 14:57:12 -0400,20240625,20260421-wellesley-marc.xml
