title_as_recorded,title_as_recorded_agr,uniform_title_as_recorded,uniform_title_as_recorded_agr,authorized_label_add,ds_qid_add,authorized_label,ds_qid
Ars Poetica and Epistulae,,,,,,Ars poetica;Epistulae,Q20009;Q38387
Laelius de Amicitia,,,,,,Laelius de amicitia,Q20003
Ars Poetica (Art of Poetry); Carmen seculare; Epistolae (Epistles); Odes,,,,,,Ars poetica;Carmen saeculare;Epistulae;Odes,Q20009;Q19914;Q38387;Q20011
Statuta nova (New Statutes),,,,,,Nova statuta,Q20023
Readings on Statutes,,,,,,Statute,Q7024
Britton,,,,,,Britton,Q19926
Statuta vetera (Old statutes),,,,,,Antiqua statuta,Q19939
Statuta vetera (Old Statutes),,,,,,Antiqua statuta,Q19939
Statuta Angliae,,,,,,Statuta Angliae,Q20016
Tractatus de maleficiis (Treatise on evil deeds),,,,,,Treatise on evil deeds,Q20012
Music Manuscript,,,,,,Music,Q20017
Missal,,,,,,Missal,Q662
De amore et dilectione Dei (On the love and favor of God); De doctrina dicendi et tacendi (On the doctrine of speaking and keeping silent); De ritu et moribus Indorum (On the rites and ways of the Indians); Historia de preliis Alexandri Magni (History of the battles of Alexander the Great); Pseudo-Sibylline Prophecy; Sermones quattuor (Four sermons),,,,,,De amore Dei;Liber de doctrina dicendi et tacendi;De ritu et moribus Indorum;Historia de preliis Alexandri Magni;Sibylline oracles;Sermons,Q1403;Q19982;Q19992;Q20007;Q19918;Q1400
De consolatione philosophiae; De mirabilis mundi; Grammatical treatise ?; Unidentified theological treatise; Miscellany,,,,,,De consolatione philosophiae;De mirabilibus mundi;Grammatical text;Theological text;Miscellany,Q2832;Q19931;Q6010;Q5950;Q3673
Canon super almanach; De 12 signis et eorum naturis in generali,,,,,,Canon super almanach;De 12 signis et eorum naturis in generali,Q19944;Q20031
Hexameron,,,,,,Hexameron,Q5995
De casu diaboli (On the Fall of the Devil),,,,,,De casu diaboli,Q20028
"Antiphonary, Dominican use",,,,,,Antiphonary,Q654
Processional,,,,,,Processional,Q1336
Fragments from a Gradual,,,,,,Gradual,Q1121
Processional; Astronomical Text binding fragment,,,,,,Processional;Astronomical text;Binding fragment,Q1336;Q38381;Q10843
"Antiphonary, diurnal (Ambrosian Rite)",,,,,,Antiphonary,Q654
Antiphonary,,,,,,Antiphonary,Q654
De censuris ecclesiasticis; Three papal bulls,,,,,,Tractatus de censuris ecclesiasticis;Papal bull,Q19965;Q1362
Organon and related texts,,,,,,Organon,Q7843
Secreta secretorum (Secrets of Secrets),,,,,,Secretum Secretorum,Q20000
Armorial,,,,,,Armorial,Q19940
Liber de vinis,,,,,,De vinis,Q19955
In epistolam Johannis ad Parthos (Sermons on the first epistle of Saint John),,,,,,In epistolam Johannis ad Parthos,Q19921
De quattuor virtutibus caritatis (On the four virtues of charity),,,,,,De quattuor virtutibus caritatis,Q19934
De sermone domini in monte habito (On the sermon on the mount) and other treatises; De superbia (On pride) and other treatises; Expositio dominice orationis (Exposition on the lord's prayer),,,,,,Sermons;De superbia;Orationes,Q1400;Q20021;Q799
Enarrationes in psalmos (Expositions on the psalms); Initials (ABC); Prayer,,,,,,Enarrations on the Psalms;Prayer,Q19979;Q20014
Sermons,,,,,,Sermons,Q1400
De forma honestae vitae; De institutione monachorum,,,,,,De forma honestae vitae;De institutione monachorum,Q19972;Q20026
De consideratione (On Consideration),,,,,,De consideratione,Q10840
Flores; religious miscellany,,,,,,Flores;Religious texts,Q19980;Q5037
Bible,,,,,,Bible,Q661
Bible; Notes on a church synod,,,,,,Bible;Notes on a church synod,Q661;Q20008
"Biblical commentary on the Pentateuch (Exodus, Leviticus, Numbers)",,,,,,Bible commentary,Q1433
"Bible, glossed Mark",,,,,,Bible;Gospel of Mark,Q661;Q1347
Biblical commentary,,,,,,Bible commentary,Q1433
"Bible, Epistles",,,,,,Bible;Epistles,Q661;Q1466
"Bible, with glossa ordinaria",,,,,,Bible;Glossa ordinaria,Q661;Q1116
Biblical commentary on the Old Testament--I Kings - Esther,,,,,,Bible commentary,Q1433
Bible Commentary,,,,,,Bible commentary,Q1433
Liber primus distinctionum super decretales,,,,,,Liber primus distinctionum super Decretales,Q19962
Breviary,,,,,,Breviary,Q657
"Breviary, Use of Ghent",,,,,,Breviary,Q657
Biography of Petrarch; Glosse de libris meteororum (Gloss on the Book of Meteors); Glosse de libris meteororum IV (Gloss on the Book of Meteors IV),,,,,,Miscellany,Q3673
De primo bello punico (On the first Punic War),,,,,,De primo bello Punico,Q19970
Carmen in honorem Beatae Mariae Virginis,,,,,,Carmen in honorem beatae mariae virginis,Q20015
"Carta executoria, in favor of Luís and Andrés Ordóñez",,,,,,Carta ejecutoria,Q3718
"Carta executoria, in favor of Juan de Londono",,,,,,Carta ejecutoria,Q3718
Golden Bull of Charles IV,,,,,,Golden bull,Q19950
Constitutiones clementinae (Clementine constitutions),,,,,,Clementine Constitutions,Q20002
Epistolae ad familiares (Letters to friends),,,,,,Epistolae ad familiares,Q19958
Chronica summorum pontificum et imperatorum romanorum (Chronicle of Popes and Emperors),,,,,,Chronica summorum pontificum et imperatorum Romanorum,Q19986
Chart of Consanguinity; Schwabenspiegel Landrecht (Common Law of the Swabians),,,,,,Chart of consanguinity;Schwabenspiegel Landrecht,Q19935;Q19987
Letter to Damasus on the death of Saint Jerome,,,,,,Letter to Damasus on the death of Saint Jerome,Q19947
Excerpta orationum Demosthenis et Aeschini (Excerpts of the Orations of Demosthenes and Aeschines); Historia Romana (History of Rome),,,,,,Excerpta orationum Demosthenis et Aeschini;Historia Romana,Q19928;Q19995
"Compendium historiae in genealogia christi (Historical compendium of the genealogy of Christ), with a treatise on the candelabrum",,,,,,Compendium historiae in genealogia Christi;Treatise on the candelabrum,Q5984;Q20013
Gradual,,,,,,Gradual,Q1121
Index to moralia in job; Legenda sanctorum (Lives of the saints),,,,,,Moralia in Job;Legenda sanctorum;Lives of the Saints,Q863;Q20034;Q1483
Decretals with Glossa ordinaria of bernardo da parma,,,,,,Decretals,Q1447
Liturgical text; Manipulus curatorum (Handbook for priests),,,,,,Manipulus curatorum,Q17579
Expositio super orationem dominicam (Exposition on Sunday oration); Expositio super salutationem angelicam (Exposition on the annunciation),,,,,,Expositio super orationem dominicam;Expositio super salutationem angelicam,Q19925;Q19945
Epistola ad Iheronimum (Letter to Jerome); Vitae patrum (Lives of the Fathers),,,,,,Correspondence of Jerome;Lives of the Fathers,Q38383;Q1429
Vitae patrum (Lives of the Fathers),,,,,,Lives of the Fathers,Q1429
Historia belli civilis inter Caesarem et Pompeium,,,,,,Historia belli civilis inter Caesarem et Pompeium,Q19913
Theological miscellany,,,,,,Theological texts,Q822
"Book of Hours, Use of Besançon?",,,,,,Book of hours,Q795
"Book of Hours, use of Bourges",,,,,,Book of hours,Q795
"Book of Hours, Use of Bourges",,,,,,Book of hours,Q795
"Book of Hours, Use of Utrecht",,,,,,Book of hours,Q795
"Book of Hours, Use of Châlons",,,,,,Book of hours,Q795
"Book of Hours, Use of Coutances",,,,,,Book of hours,Q795
"Book of Hours, use of Paris",,,,,,Book of hours,Q795
"Book of Hours, Use of Paris",,,,,,Book of hours,Q795
"Book of hours, Use of Paris",,,,,,Book of hours,Q795
"Book of Hours, Use of Rome",,,,,,Book of hours,Q795
"Book of Hours, use of Rome",,,,,,Book of hours,Q795
"Book of Hours, use of Rome; Litany and Prayers",,,,,,Book of hours;Litany;Prayers,Q795;Q1378;Q798
"Book of Hours, Use of Rouen",,,,,,Book of hours,Q795
"Book of Hours, Use of Soissons?",,,,,,Book of hours,Q795
"Book of Hours, use of Tours",,,,,,Book of hours,Q795
"Book of Hours, Use of Utrecht; Scenes from the Life of Christ",,,,,,Book of hours;Life of Christ,Q795;Q19961
"Book of Hours, Use of Troyes",,,,,,Book of hours,Q795
"Prayer Book, Use of Cologne",,,,,,Prayer book,Q1486
De claustro animae (The cloister of the soul),,,,,,De claustro animae,Q19989
Carta pisana; Sententiae (Sentences),,,,,,Carta pisana;Sentences,Q19974;Q1119
Sententiae (Sentences),,,,,,Sentences,Q1119
Historia hierosolymitana (History of Jerusalem),,,,,,Historia hierosolymitana,Q19929
Excerpts from De viris illustribus (On Famous Men); Excerpts from the Supplementum chronicarum; Excerpts from the Vita Henrici Quinti (Life of Henry V); Excerpts from works on Venice; Rumores e venetiis allati...,,,,,,Miscellany,Q3673
"Rule of the order of the Jesuati of San Giusto alle mura, Florence",,,,,,Rule of Jesuati of San Giusto alle mura,Q20001
Repertorium juris civilis (Catalog of Civil Law),,,,,,Repertorium juris civilis,Q19953
Dogale,,,,,,Dogale,Q2827
Fragment of a lectionary,,,,,,Lectionary,Q663
Lectionary,,,,,,Lectionary,Q663
Epistolary,,,,,,Epistolary,Q19936
Libellus beati misericordes (A collection of excerpts from the latin fathers),,,,,,Libellus beati misericordes,Q19963
Periochae,,,,,,Periochae,Q19975
Religious manual,,,,,,Religious text,Q1465
Fragment of a Martyrology,,,,,,Martyrology,Q19946
Tobias (History of Tobias),,,,,,Bible;Book of Tobit,Q661;Q19991
Fragment of a Menologium,,,,,,Menologium,Q19993
"Missal, use of Rome",,,,,,Missal,Q662
"Noted Missal, Dominican use",,,,,,Missal,Q662
Fragment of a Missal,,,,,,Missal,Q662
Gospel lectionary,,,,,,Lectionary,Q663
Lectura super quintum librum Decretalium (Commentary on the Fifth Book of Decretals),,,,,,Commentary on decretals,Q20032
Oedipi et Sphingis dialogus (Dialogues between Oedipus and the Sphinx); Le Sphinx,,,,,,Oedipi et sphingis dialogus,Q19983
Compendium logicae (Compendium of logic),,,,,,Compendium logicae,Q19919
Summa de virtutibus (Treatise on the virtues); Summa vitiorum (Treatise on the vices),,,,,,Summa de virtutibus;Summa vitiorum,Q19966;Q19954
Tractatus moralis de virtutibus (Moral Tract on the Virtues),,,,,,Tractatus moralis de virtutibus,Q20029
Historia scholastica,,,,,,Historia Scholastica,Q1372
Aurora,,,,,,Aurora,Q7839
Liber IV sententiarum (Four Books of Sentences),,,,,,Sentences,Q1119
Pontifical,,,,,,Pontifical,Q1375
Prayer book,,,,,,Prayer book,Q1486
Prayer against the plague; Prayer book,,,,,,Prayer book,Q1486
Prayer Book,,,,,,Prayer book,Q1486
Psalter,,,,,,Psalter,Q660
Psalter-Hours,,,,,,Psalter;Book of hours,Q660;Q795
Lewis Psalter,,,,,,Psalter;Lewis psalter,Q660;Q20022
"Psalter, glossed",,,,,,Psalter,Q660
Complementum in partem III Summae S. Thomae de Aquino (Complement to the third part of the Summae of St. Thomas Aquinas),,,,,,Complementum in partem III summae S. Thomae de Aquino,Q19968
Rituale Dominicanum (Dominican Ritual),,,,,,Rituale Dominicanum,Q19994
"Vitae XII caesarium (Lives of the twelve caesars), fragment and Book of Hours leaf",,,,,,Lives of the twelve Caesars;Book of hours,Q20027;Q795
Comediae,,,,,,Comediae,Q19957
Expositio in civitatem dei S. Augustini (Commentary on St. Augustine's City of god),,,,,,Expositio in civitatem dei S. Augustini,Q20024
Opera,,,,,,Opera,Q19943
Legenda aurea (Golden Legend),,,,,,Golden Legend,Q7220
"Chronicle of the History of the World from Creation to Woden, with a Genealogy of Edward IV",,,,,,Chronicle,Q1475
Compendium historiae in genealogia Christi (Historical Compendium of the Genealogy of Christ),,,,,,Compendium historiae in genealogia Christi,Q5984
Harmony of the Bible,,,,,,Harmony of the Bible,Q19916
Menologium,,,,,,Menologium,Q19993
Stella di salute,,,,,,Stella di salute,Q20010
Les dits moraulx des philosophes,,,,,,Dits moraux des philosophes,Q19922
Le chemin de paradis (The way to paradise),,,,,,Le chemin de paradis,Q19937
Noels (Christmas carols),,,,,,Hymnal;Carols,Q666;Q17601
Rule of Saint Augustine; Sermon on Matthew 25:6,,,,,,Rule of Saint Augustine;Sermons,Q5976;Q1400
Summa confessionis,,,,,,Summa confessionis,Q19978
Postilla epistolarum dominicalium,,,,,,Postilla epistolarum dominicalium,Q19971
Meditationes de passione christi,,,,,,Meditationes de Passione Christi,Q20020
De precetti della lege divina sacramento simbolo et altre cose della dottrina christiana,,,,,,De precetti della lege divina sacramento simbolo et altre cose della dottrina christiana,Q19951
Choir psalter; Hymnal,,,,,,Choir psalter;Hymnal,Q19999;Q666
Grammatical treatise,,,,,,Grammatical text,Q6010
Ad adolescentes de legendis libris gentilium (Address to young men on the right use of greek literature),,,,,,Ad adolescentes de legendis libris gentilium,Q19990
Brut Chronicle,,,,,,Chronicle,Q1475
"Bible, Gospels",,,,,,Bible;Gospels,Q661;Q6034
Revelations,,,,,,Revelations,Q1480
Carta executoria,,,,,,Carta ejecutoria,Q3718
"Bible, glossed minor prophets; Missal",,,,,,Bible;Minor prophets;Missal,Q661;Q19984;Q662
Infortiatum,,,,,,Infortiatum,Q19969
Fuero real (Royal municipal code),,,,,,Fuero real,Q19915
De differentia translationis nostrae ab hebraica littera veteris testamentum,,,,,,De differentia translationis nostrae ab Hebraica littera Veteris testamentum,Q19997
Gesta regum Anglorum (Deeds of the English Kings); Historia regum Britanniae (History of the Kings of Britain),,,,,,Gesta Regum Anglorum;History of the Kings of Britain,Q12753;Q6056
"Summa de casibus poenitentia, glossed",,,,,,Summa de casibus poenitentia,Q20005
Compendium historiae in genealogia Christi (The Compendium of History in the Genealogy of Christ); Explanation of the Wheel of Sevens,,,,,,Compendium historiae in genealogia Christi;Explanation of the wheel of sevens,Q5984;Q19959
Treatise on the construction of an astrolabe,,,,,,Treatise on astrolabes,Q27631
Enarratio in prophetam Isaiam,,,,,,Enarratio in prophetam Isaiam,Q19985
Manuscript of an evangelist and prebendary of the minor orders,,,,,,Evangeliary,Q20460
Devotional extracts from the bible,,,,,,Devotional texts,Q5966
"Breviary, Cistercian use",,,,,,Breviary,Q657
Life of Holy Francis and his companions,,,,,,Life of Saint Francis,Q19927
Schwabenspiegel,,,,,,Schwabenspiegel,Q20018
Carta executoria a pedimiento de Alonso Mendez de Parada,,,,,,Carta ejecutoria,Q3718
"Collationes XXIV, incomplete",,,,,,Collationes,Q19964
Choir book,,,,,,Choir book,Q1449
Enarrationes in psalmos (Expositions on the Psalms),,,,,,Enarrations on the Psalms,Q19979
Lives of the Saints,,,,,,Lives of the Saints,Q1483
Devotional Image (Andachtsbild),,,,,,Devotional image,Q19960
St. Notburga,,,,,,Saint Notburga,Q51657
Choir books,,,,,,Choir book,Q1449
Undetermined,,,,,,Unknown,Q19938
Legal treatise,,,,,,Legal text,Q8041
Unknown,,,,,,Unknown,Q19938
Book of Hours,,,,,,Book of hours,Q795
Dominican friar,,,,,,,
"Psalter, noted",,,,,,Psalter,Q660
Service book,,,,Service book,Q40008,,
Commentary on the altar at the temple,,,,,,Commentary,Q1376
St. Martha,,,,,,Saint Martha,Q51658
Decretals,,,,,,Decretals,Q1447
Bible historiale,,,,,,Bible,Q661
Gospel Lectionary,,,,,,Lectionary,Q663
Leaf with miniature of Christ blessing a kneeling couple,,,,,,Miniature,Q19998
Hours of Louis XII (formerly Hours of Henry VII),,,,,,Book of hours;Hours of Louis XII,Q795;Q19941
St. Dominic,,,,,,Saint Dominic,Q1456
Forgery,,,,,,Forgery,Q2829
Decorated initial I,,,,,,Decorated initial,Q19949
Inhabited initial S,,,,,,Inhabited initial,Q19933
Decorated initial Q,,,,,,Decorated initial,Q19949
Decorated initial D,,,,,,Decorated initial,Q19949
Decorated initial T,,,,,,Decorated initial,Q19949
Decorated initial P,,,,,,Decorated initial,Q19949
Decorated initial S,,,,,,Decorated initial,Q19949
Music Fragment,,,,,,Music,Q20017
Decorated initial L,,,,,,Decorated initial,Q19949
Decorated initial M,,,,,,Decorated initial,Q19949
Inhabited initial U,,,,,,Inhabited initial,Q19933
Decorated border detail,,,,,,Border detail,Q39453
Decorated initial C,,,,,,Decorated initial,Q19949
Decorated initial B,,,,,,Decorated initial,Q19949
Decorated initial H,,,,,,Decorated initial,Q19949
Decorated initial G,,,,,,Decorated initial,Q19949
Decorated initial A,,,,,,Decorated initial,Q19949
Border detail fragment,,,,,,Border detail;Border fragment,Q39453;Q20428
Decorated initial N,,,,,,Decorated initial,Q19949
Decorated initial O,,,,,,Decorated initial,Q19949
Historiated initial U depicting the Resurrected Christ blessing Mary Magdalene,,,,,,Historiated initial,Q19917
"Historiated initial I depicting a pope, cardinal, and bishops",,,,,,Historiated initial,Q19917
Historiated initial M depicting Saint Margaret of Antioch,,,,,,Historiated initial,Q19917
Historiated initial G depicting All Saints,,,,,,Historiated initial,Q19917
Historiated initial A depicting Christ as the Good Shepherd,,,,,,Historiated initial,Q19917
Historiated initial G depicting John and Peter discovering the empty tomb,,,,,,Historiated initial,Q19917
Historiated initial B depicted Saints Nicholas and Julian,,,,,,Historiated initial,Q19917
"Historiated initial O depicting the Resurrected Christ, St. Thomas, and the Apostles",,,,,,Historiated initial,Q19917
Miniature depicting the Transfiguration of Christ,,,,,,Miniature,Q19998
Historiated initial I depicting Joshua's messengers returning from the Promised Land,,,,,,Historiated initial,Q19917
Historiated initial M depicting the parable of the Good Shepherd,,,,,,Historiated initial,Q19917
Historiated initial U depicting the second miraculous catch of fish,,,,,,Historiated initial,Q19917
Historiated initial N depicting St. Helena finding the True Cross,,,,,,Historiated initial,Q19917
Historiated initial U depicting Samson removing the Gates of Gaza,,,,,,Historiated initial,Q19917
Historiated initial E depicting the destruction of the Egyptians in the Red Sea,,,,,,Historiated initial,Q19917
Historiated initial C depicting the Last Supper,,,,,,Historiated initial,Q19917
Historiated initial R depicting Christ sitting in judgment,,,,,,Historiated initial,Q19917
Historiated initial S depicting the Assumption,,,,,,Historiated initial,Q19917
Historiated initial L depicting the supper at Emmaus,,,,,,Historiated initial,Q19917
Historiated initial M depicting God the Father surrounded by the four Gospels,,,,,,Historiated initial,Q19917
Historiated initial O depicting the Ascension,,,,,,Historiated initial,Q19917
Historiated initial G depicting the Assumption,,,,,,Historiated initial,Q19917
"Historiated initial G depicting the Trinity with saints below, including Mary and John the Baptist",,,,,,Historiated initial,Q19917
Miniature depicting All Saints,,,,,,Miniature,Q19998
Miniature depicting Disciples,,,,,,Miniature,Q19998
Miniature depicting sainted clergy,,,,,,Miniature,Q19998
Miniature depicting Michael Archangel,,,,,,Miniature,Q19998
Miniature depicting the Archangel Gabriel and Joseph,,,,,,Miniature,Q19998
Miniature depicting Vincent of Saragossa being thrown into the water,,,,,,Miniature,Q19998
Miniature depicting Michael the Archangel fighting the dragon with his angels,,,,,,Miniature,Q19998
Moralia in Job,,,,,,Moralia in Job,Q863
"Homilia XI, In vigilia Pentecostes",,,,,,In vigilia pentecostes,Q20512
Expositio psalmorum (Commentary on the Psalms),,,,,,Bible commentary;Commentary on Psalms,Q1433;Q20442
Decretum,,,,,,Decretals,Q1447
De Noe et Arca,,,,,,De Noe et arca,Q20414
Registrum epistolarum (Register of Letters),,,,,,Registrum epistolarum,Q20388
Historiated initial D depicting Christ's entry into Jerusalem,,,,,,Historiated initial,Q19917
Miniature depicting St. Bridget of Sweden,,,,,,Miniature,Q19998
Miniature of Daniel interpreting the dream of Nebuchadnezzar,,,,,,Miniature,Q19998
Historiated initial A from an antiphonary depicting the Agnus Dei,,,,,,Historiated initial,Q19917
Miniature of the Holy Family,,,,,,Miniature,Q19998
Coat of arms,,,,,,Coat of arms,Q20455
"Miniature of Kaiser Konrad receiving the Smith, Konrad Stich",,,,,,Miniature,Q19998
Miniature depicting battle between Abner and Joab,,,,,,Miniature,Q19998
Scenes from story of Joseph and his brethren,,,,,,Joseph and his brethren,Q20392
"Death with armful of symbols of rank, in a churchyard",,,,,,Death,Q51662
"Lady in ship escorted by fame and fortune, Jupiter and Juno above",,,,,,Drawing,Q20466
Miniature of a children's game: children dancing around the cock,,,,,,Miniature,Q19998
Miniature of a pair of lovers,,,,,,Miniature,Q19998
"Miniature of a dispute over the housekeeper's keys, with feasting couple in background",,,,,,Miniature,Q19998
Miniature of the sly fox,,,,,,Miniature,Q19998
"Miniature of the devil rejoicing over a brew made of monks, nuns, and priests",,,,,,Miniature,Q19998
Miniature of the alchemist's thieving apprentice,,,,,,Miniature,Q19998
Miniature of St. Anthony resisting temptation,,,,,,Miniature,Q19998
Miniature of Hercules' choice,,,,,,Miniature,Q19998
Drawing of a young flute player,,,,,,Drawing,Q20466
"Bible, Matthew",,,,,,Bible;Gospel of Matthew,Q661;Q1389
"Bible, glossed Epistles of Paul",,,,,,Bible;Pauline Epistles,Q661;Q38384
Laudario (Hymnal),,,,,,Hymnal,Q666
Historiated initial A depicting the Virgin enthroned,,,,,,Historiated initial,Q19917
Choir psalter,,,,,,Psalter,Q660
Corpus iuris civilis (Corpus of Civil Law),,,,,,Corpus Juris Civilis,Q5057
"Historiated initial O depicting St. Dominic preaching on the Ascension; above, Christ in a mandorla",,,,,,Historiated initial;Saint Dominic,Q19917;Q1456
Historiated initial O from an antiphonal depicting a prophet (Ezekiel),,,,,,Historiated initial,Q19917
St. Francis exalts the spring and the tree,,,,,,Saint Francis,Q20489
"St. Francis meets Chastity, Poverty, and Obedience",,,,,,Saint Francis,Q20489
"Historiated initial P from an antiphonary, depicting St. Peter of Verona",,,,,,Historiated initial,Q19917
"Historiated initial L from a gradual, depicting Christ",,,,,,Historiated initial,Q19917
"Frontispiece from a Dogale, with Contarini arms",,,,,,Dogale frontispiece,Q20408
"Frontispiece from a Dogale, depicting the Transfiguration",,,,,,Dogale frontispiece,Q20408
Chronici canones,,,,,,Chronici canones,Q20413
Historiated initial I from a missal depicting St. Luke writing,,,,,,Historiated initial,Q19917
Breviary (or Psalter),,,,,,Breviary;Psalter,Q657;Q660
Historiated initial O from an antiphonary depicting clergy communing with God,,,,,,Historiated initial,Q19917
"Historiated initial S from an antiphonary, depicting King David communing with God",,,,,,Historiated initial,Q19917
"Historiated initial D from an antiphonary, depicting St. Paul",,,,,,Historiated initial,Q19917
"Historiated initial C from an antiphonary, with a Saint, possibly St. Ambrose, praying to God",,,,,,Historiated initial,Q19917
Historiated initial G from an antiphonary depicting the Invention of the Cross,,,,,,Historiated initial,Q19917
"Historiated initial D from a gradual, depicting the baptism of Christ",,,,,,Historiated initial,Q19917
"Miniature from a choir book, depicting the Trinity",,,,,,Miniature,Q19998
"Historiated initial D from a breviary depicting St. Nicholas, Bishop of Myra",,,,,,Historiated initial,Q19917
Leaf from a breviary with an initial F depicting the Assumption of the Virgin,,,,,,Breviary;Historiated initial,Q657;Q19917
Painting of Christ crowned with thorns,,,,,,Painting,Q38348
Miniature from an alchemical manuscript,,,,,,Miniature,Q19998
"Historiated initial P from an antiphonary, depicting the Nativity",,,,,,Historiated initial,Q19917
Hymnal,,,,,,Hymnal,Q666
Miniature of twelve virgin saints,,,,,,Miniature,Q19998
Psalter or Breviary,,,,,,Psalter;Breviary,Q660;Q657
Matricola (Matriculation list),,,,,,Matricola,Q20373
Miniature of St. John the Evangelist,,,,,,Miniature,Q19998
Leaf from a Book of Hours depicting the Last Supper,,,,,,Book of hours,Q795
Initial A with the Invocation of the Virgin Mary,,,,,,Historiated initial,Q19917
Historiated initial A from an antiphonary depicting the Invocation of the Virgin Mary,,,,,,Historiated initial,Q19917
"Historiated initial N from an antiphonary, depicting St. John the Baptist",,,,,,Historiated initial,Q19917
Historiated initial G from an antiphonary depicting David as a musician,,,,,,Historiated initial,Q19917
Flight into Egypt,,,,,,Flight into Egypt,Q51663
Miniature of Christ calling Peter and Andrew,,,,,,Miniature,Q19998
Initial D from an antiphonary depicting a penitent gentleman taking a vow at an altar,,,,,,Historiated initial,Q19917
Miniature of the Presentation in the Temple,,,,,,Miniature,Q19998
Historiated initial D,,,,,,Historiated initial,Q19917
Historiated initial A depicting a cleric,,,,,,Historiated initial,Q19917
Historiated initial O depicting David in Prayer,,,,,,Historiated initial,Q19917
Historiated initial E depicting a male saint,,,,,,Historiated initial,Q19917
Forged miniature panel,,,,,,Forgery,Q2829
Historiated initial O depicting a cleric,,,,,,Historiated initial,Q19917
Miniature of Jesus in prayer,,,,,,Miniature,Q19998
Historiated initial D depicting St. Barbara,,,,,,Historiated initial,Q19917
Historiated initial D depicting a monk,,,,,,Historiated initial,Q19917
Historiated initial C depicting a bishop,,,,,,Historiated initial,Q19917
Historiated initial D depicting a male saint,,,,,,Historiated initial,Q19917
Historiated initial E depicting Christ and three angels,,,,,,Historiated initial,Q19917
Leaf from a printed Book of Hours depicting the Annunciation,,,,,,Book of hours,Q795
Madonna and child,,,,,,Madonna and Child,Q51664
Adoration of the Magi,,,,,,Adoration of the Magi,Q1455
Historiated initial S depicting the Presentation in the Temple,,,,,,Historiated initial,Q19917
Historiated initial A depicting the Agnus Dei,,,,,,Historiated initial,Q19917
"Historiated initial, forged",,,,,,Forgery,Q2829
Historiated initial depicting Virgin Mary,,,,,,Historiated initial,Q19917
Historiated Initial A,,,,,,Historiated initial,Q19917
"Historiated initial O with a pope kneeling at an altar, communing with an angel",,,,,,Historiated initial,Q19917
Miniature of monks reading from a lectern,,,,,,Miniature,Q19998
Historiated initial S depicting All Saints,,,,,,Historiated initial,Q19917
Initial C from a choir book with singing monks,,,,,,Historiated initial,Q19917
Forgery fragment,,,,,,Forgery,Q2829
Initial G with a priest celebrating the Eucharist,,,,,,Historiated initial,Q19917
Bishop,,,,,,,
Historiated initial U with female saint,,,,,,Historiated initial,Q19917
Three Marys at the tomb,,,,,,Three Marys at the Tomb,Q10850
Life of Thomas Aquinas,,,,,,Life of Thomas Aquinas,Q20514
St. Theodore,,,,,,Saint Theodore,Q51659
St. Bartholomew,,,,,,Saint Bartholomew,Q51661
